Parsed test spec with 2 sessions

starting permutation: s2b s2i s2c s1b s1merg s2b s2u s1c s2c s2s
step s2b: BEGIN;
step s2i: INSERT INTO tpart VALUES (1, 'text01');
step s2c: COMMIT;
step s1b: BEGIN;
step s1merg: ALTER TABLE tpart MERGE PARTITIONS (tpart_00_10, tpart_10_20) INTO tpart_00_20;
step s2b: BEGIN;
step s2u: UPDATE tpart SET t = 'text01modif' where i = 1; <waiting ...>
step s1c: COMMIT;
step s2u: <... completed>
step s2c: COMMIT;
step s2s: SELECT * FROM tpart;
 i|t          
--+-----------
 5|text05     
15|text15     
 1|text01modif
25|text25     
35|text35     
(5 rows)


starting permutation: s2b s2i s2c s1brr s1merg s2b s2u s1c s2c s2s
step s2b: BEGIN;
step s2i: INSERT INTO tpart VALUES (1, 'text01');
step s2c: COMMIT;
step s1brr: BEGIN ISOLATION LEVEL REPEATABLE READ;
step s1merg: ALTER TABLE tpart MERGE PARTITIONS (tpart_00_10, tpart_10_20) INTO tpart_00_20;
step s2b: BEGIN;
step s2u: UPDATE tpart SET t = 'text01modif' where i = 1; <waiting ...>
step s1c: COMMIT;
step s2u: <... completed>
step s2c: COMMIT;
step s2s: SELECT * FROM tpart;
 i|t          
--+-----------
 5|text05     
15|text15     
 1|text01modif
25|text25     
35|text35     
(5 rows)


starting permutation: s2b s2i s2c s1bs s1merg s2b s2u s1c s2c s2s
step s2b: BEGIN;
step s2i: INSERT INTO tpart VALUES (1, 'text01');
step s2c: COMMIT;
step s1bs: BEGIN ISOLATION LEVEL SERIALIZABLE;
step s1merg: ALTER TABLE tpart MERGE PARTITIONS (tpart_00_10, tpart_10_20) INTO tpart_00_20;
step s2b: BEGIN;
step s2u: UPDATE tpart SET t = 'text01modif' where i = 1; <waiting ...>
step s1c: COMMIT;
step s2u: <... completed>
step s2c: COMMIT;
step s2s: SELECT * FROM tpart;
 i|t          
--+-----------
 5|text05     
15|text15     
 1|text01modif
25|text25     
35|text35     
(5 rows)


starting permutation: s2brr s2i s2c s1b s1merg s2b s2u s1c s2c s2s
step s2brr: BEGIN ISOLATION LEVEL REPEATABLE READ;
step s2i: INSERT INTO tpart VALUES (1, 'text01');
step s2c: COMMIT;
step s1b: BEGIN;
step s1merg: ALTER TABLE tpart MERGE PARTITIONS (tpart_00_10, tpart_10_20) INTO tpart_00_20;
step s2b: BEGIN;
step s2u: UPDATE tpart SET t = 'text01modif' where i = 1; <waiting ...>
step s1c: COMMIT;
step s2u: <... completed>
step s2c: COMMIT;
step s2s: SELECT * FROM tpart;
 i|t          
--+-----------
 5|text05     
15|text15     
 1|text01modif
25|text25     
35|text35     
(5 rows)


starting permutation: s2brr s2i s2c s1brr s1merg s2b s2u s1c s2c s2s
step s2brr: BEGIN ISOLATION LEVEL REPEATABLE READ;
step s2i: INSERT INTO tpart VALUES (1, 'text01');
step s2c: COMMIT;
step s1brr: BEGIN ISOLATION LEVEL REPEATABLE READ;
step s1merg: ALTER TABLE tpart MERGE PARTITIONS (tpart_00_10, tpart_10_20) INTO tpart_00_20;
step s2b: BEGIN;
step s2u: UPDATE tpart SET t = 'text01modif' where i = 1; <waiting ...>
step s1c: COMMIT;
step s2u: <... completed>
step s2c: COMMIT;
step s2s: SELECT * FROM tpart;
 i|t          
--+-----------
 5|text05     
15|text15     
 1|text01modif
25|text25     
35|text35     
(5 rows)


starting permutation: s2brr s2i s2c s1bs s1merg s2b s2u s1c s2c s2s
step s2brr: BEGIN ISOLATION LEVEL REPEATABLE READ;
step s2i: INSERT INTO tpart VALUES (1, 'text01');
step s2c: COMMIT;
step s1bs: BEGIN ISOLATION LEVEL SERIALIZABLE;
step s1merg: ALTER TABLE tpart MERGE PARTITIONS (tpart_00_10, tpart_10_20) INTO tpart_00_20;
step s2b: BEGIN;
step s2u: UPDATE tpart SET t = 'text01modif' where i = 1; <waiting ...>
step s1c: COMMIT;
step s2u: <... completed>
step s2c: COMMIT;
step s2s: SELECT * FROM tpart;
 i|t          
--+-----------
 5|text05     
15|text15     
 1|text01modif
25|text25     
35|text35     
(5 rows)


starting permutation: s2bs s2i s2c s1b s1merg s2b s2u s1c s2c s2s
step s2bs: BEGIN ISOLATION LEVEL SERIALIZABLE;
step s2i: INSERT INTO tpart VALUES (1, 'text01');
step s2c: COMMIT;
step s1b: BEGIN;
step s1merg: ALTER TABLE tpart MERGE PARTITIONS (tpart_00_10, tpart_10_20) INTO tpart_00_20;
step s2b: BEGIN;
step s2u: UPDATE tpart SET t = 'text01modif' where i = 1; <waiting ...>
step s1c: COMMIT;
step s2u: <... completed>
step s2c: COMMIT;
step s2s: SELECT * FROM tpart;
 i|t          
--+-----------
 5|text05     
15|text15     
 1|text01modif
25|text25     
35|text35     
(5 rows)


starting permutation: s2bs s2i s2c s1brr s1merg s2b s2u s1c s2c s2s
step s2bs: BEGIN ISOLATION LEVEL SERIALIZABLE;
step s2i: INSERT INTO tpart VALUES (1, 'text01');
step s2c: COMMIT;
step s1brr: BEGIN ISOLATION LEVEL REPEATABLE READ;
step s1merg: ALTER TABLE tpart MERGE PARTITIONS (tpart_00_10, tpart_10_20) INTO tpart_00_20;
step s2b: BEGIN;
step s2u: UPDATE tpart SET t = 'text01modif' where i = 1; <waiting ...>
step s1c: COMMIT;
step s2u: <... completed>
step s2c: COMMIT;
step s2s: SELECT * FROM tpart;
 i|t          
--+-----------
 5|text05     
15|text15     
 1|text01modif
25|text25     
35|text35     
(5 rows)


starting permutation: s2bs s2i s2c s1bs s1merg s2b s2u s1c s2c s2s
step s2bs: BEGIN ISOLATION LEVEL SERIALIZABLE;
step s2i: INSERT INTO tpart VALUES (1, 'text01');
step s2c: COMMIT;
step s1bs: BEGIN ISOLATION LEVEL SERIALIZABLE;
step s1merg: ALTER TABLE tpart MERGE PARTITIONS (tpart_00_10, tpart_10_20) INTO tpart_00_20;
step s2b: BEGIN;
step s2u: UPDATE tpart SET t = 'text01modif' where i = 1; <waiting ...>
step s1c: COMMIT;
step s2u: <... completed>
step s2c: COMMIT;
step s2s: SELECT * FROM tpart;
 i|t          
--+-----------
 5|text05     
15|text15     
 1|text01modif
25|text25     
35|text35     
(5 rows)

