--
-- Cursor regression tests
--
BEGIN;
DECLARE foo1 SCROLL CURSOR FOR SELECT * FROM tenk1 ORDER BY unique2;
DECLARE foo2 SCROLL CURSOR FOR SELECT * FROM tenk2;
DECLARE foo3 SCROLL CURSOR FOR SELECT * FROM tenk1 ORDER BY unique2;
DECLARE foo4 SCROLL CURSOR FOR SELECT * FROM tenk2;
DECLARE foo5 SCROLL CURSOR FOR SELECT * FROM tenk1 ORDER BY unique2;
DECLARE foo6 SCROLL CURSOR FOR SELECT * FROM tenk2;
DECLARE foo7 SCROLL CURSOR FOR SELECT * FROM tenk1 ORDER BY unique2;
DECLARE foo8 SCROLL CURSOR FOR SELECT * FROM tenk2;
DECLARE foo9 SCROLL CURSOR FOR SELECT * FROM tenk1 ORDER BY unique2;
DECLARE foo10 SCROLL CURSOR FOR SELECT * FROM tenk2;
DECLARE foo11 SCROLL CURSOR FOR SELECT * FROM tenk1 ORDER BY unique2;
DECLARE foo12 SCROLL CURSOR FOR SELECT * FROM tenk2;
DECLARE foo13 SCROLL CURSOR FOR SELECT * FROM tenk1 ORDER BY unique2;
DECLARE foo14 SCROLL CURSOR FOR SELECT * FROM tenk2;
DECLARE foo15 SCROLL CURSOR FOR SELECT * FROM tenk1 ORDER BY unique2;
DECLARE foo16 SCROLL CURSOR FOR SELECT * FROM tenk2;
DECLARE foo17 SCROLL CURSOR FOR SELECT * FROM tenk1 ORDER BY unique2;
DECLARE foo18 SCROLL CURSOR FOR SELECT * FROM tenk2;
DECLARE foo19 SCROLL CURSOR FOR SELECT * FROM tenk1 ORDER BY unique2;
DECLARE foo20 SCROLL CURSOR FOR SELECT * FROM tenk2;
DECLARE foo21 SCROLL CURSOR FOR SELECT * FROM tenk1 ORDER BY unique2;
DECLARE foo22 SCROLL CURSOR FOR SELECT * FROM tenk2;
DECLARE foo23 SCROLL CURSOR FOR SELECT * FROM tenk1 ORDER BY unique2;
FETCH 1 in foo1;
 unique1 | unique2 | two | four | ten | twenty | hundred | thousand | twothousand | fivethous | tenthous | odd | even | stringu1 | stringu2 | string4 
---------+---------+-----+------+-----+--------+---------+----------+-------------+-----------+----------+-----+------+----------+----------+---------
    8800 |       0 |   0 |    0 |   0 |      0 |       0 |      800 |         800 |      3800 |     8800 |   0 |    1 | MAAAAA   | AAAAAA   | AAAAxx
(1 row)

FETCH 2 in foo2;
 unique1 | unique2 | two | four | ten | twenty | hundred | thousand | twothousand | fivethous | tenthous | odd | even | stringu1 | stringu2 | string4 
---------+---------+-----+------+-----+--------+---------+----------+-------------+-----------+----------+-----+------+----------+----------+---------
    8800 |       0 |   0 |    0 |   0 |      0 |       0 |      800 |         800 |      3800 |     8800 |   0 |    1 | MAAAAA   | AAAAAA   | AAAAxx
    1891 |       1 |   1 |    3 |   1 |     11 |      91 |      891 |        1891 |      1891 |     1891 | 182 |  183 | TUAAAA   | BAAAAA   | HHHHxx
(2 rows)

FETCH 3 in foo3;
 unique1 | unique2 | two | four | ten | twenty | hundred | thousand | twothousand | fivethous | tenthous | odd | even | stringu1 | stringu2 | string4 
---------+---------+-----+------+-----+--------+---------+----------+-------------+-----------+----------+-----+------+----------+----------+---------
    8800 |       0 |   0 |    0 |   0 |      0 |       0 |      800 |         800 |      3800 |     8800 |   0 |    1 | MAAAAA   | AAAAAA   | AAAAxx
    1891 |       1 |   1 |    3 |   1 |     11 |      91 |      891 |        1891 |      1891 |     1891 | 182 |  183 | TUAAAA   | BAAAAA   | HHHHxx
    3420 |       2 |   0 |    0 |   0 |      0 |      20 |      420 |        1420 |      3420 |     3420 |  40 |   41 | OBAAAA   | CAAAAA   | OOOOxx
(3 rows)

FETCH 4 in foo4;
 unique1 | unique2 | two | four | ten | twenty | hundred | thousand | twothousand | fivethous | tenthous | odd | even | stringu1 | stringu2 | string4 
---------+---------+-----+------+-----+--------+---------+----------+-------------+-----------+----------+-----+------+----------+----------+---------
    8800 |       0 |   0 |    0 |   0 |      0 |       0 |      800 |         800 |      3800 |     8800 |   0 |    1 | MAAAAA   | AAAAAA   | AAAAxx
    1891 |       1 |   1 |    3 |   1 |     11 |      91 |      891 |        1891 |      1891 |     1891 | 182 |  183 | TUAAAA   | BAAAAA   | HHHHxx
    3420 |       2 |   0 |    0 |   0 |      0 |      20 |      420 |        1420 |      3420 |     3420 |  40 |   41 | OBAAAA   | CAAAAA   | OOOOxx
    9850 |       3 |   0 |    2 |   0 |     10 |      50 |      850 |        1850 |      4850 |     9850 | 100 |  101 | WOAAAA   | DAAAAA   | VVVVxx
(4 rows)

FETCH 5 in foo5;
 unique1 | unique2 | two | four | ten | twenty | hundred | thousand | twothousand | fivethous | tenthous | odd | even | stringu1 | stringu2 | string4 
---------+---------+-----+------+-----+--------+---------+----------+-------------+-----------+----------+-----+------+----------+----------+---------
    8800 |       0 |   0 |    0 |   0 |      0 |       0 |      800 |         800 |      3800 |     8800 |   0 |    1 | MAAAAA   | AAAAAA   | AAAAxx
    1891 |       1 |   1 |    3 |   1 |     11 |      91 |      891 |        1891 |      1891 |     1891 | 182 |  183 | TUAAAA   | BAAAAA   | HHHHxx
    3420 |       2 |   0 |    0 |   0 |      0 |      20 |      420 |        1420 |      3420 |     3420 |  40 |   41 | OBAAAA   | CAAAAA   | OOOOxx
    9850 |       3 |   0 |    2 |   0 |     10 |      50 |      850 |        1850 |      4850 |     9850 | 100 |  101 | WOAAAA   | DAAAAA   | VVVVxx
    7164 |       4 |   0 |    0 |   4 |      4 |      64 |      164 |        1164 |      2164 |     7164 | 128 |  129 | OPAAAA   | EAAAAA   | AAAAxx
(5 rows)

FETCH 6 in foo6;
 unique1 | unique2 | two | four | ten | twenty | hundred | thousand | twothousand | fivethous | tenthous | odd | even | stringu1 | stringu2 | string4 
---------+---------+-----+------+-----+--------+---------+----------+-------------+-----------+----------+-----+------+----------+----------+---------
    8800 |       0 |   0 |    0 |   0 |      0 |       0 |      800 |         800 |      3800 |     8800 |   0 |    1 | MAAAAA   | AAAAAA   | AAAAxx
    1891 |       1 |   1 |    3 |   1 |     11 |      91 |      891 |        1891 |      1891 |     1891 | 182 |  183 | TUAAAA   | BAAAAA   | HHHHxx
    3420 |       2 |   0 |    0 |   0 |      0 |      20 |      420 |        1420 |      3420 |     3420 |  40 |   41 | OBAAAA   | CAAAAA   | OOOOxx
    9850 |       3 |   0 |    2 |   0 |     10 |      50 |      850 |        1850 |      4850 |     9850 | 100 |  101 | WOAAAA   | DAAAAA   | VVVVxx
    7164 |       4 |   0 |    0 |   4 |      4 |      64 |      164 |        1164 |      2164 |     7164 | 128 |  129 | OPAAAA   | EAAAAA   | AAAAxx
    8009 |       5 |   1 |    1 |   9 |      9 |       9 |        9 |           9 |      3009 |     8009 |  18 |   19 | BWAAAA   | FAAAAA   | HHHHxx
(6 rows)

FETCH 7 in foo7;
 unique1 | unique2 | two | four | ten | twenty | hundred | thousand | twothousand | fivethous | tenthous | odd | even | stringu1 | stringu2 | string4 
---------+---------+-----+------+-----+--------+---------+----------+-------------+-----------+----------+-----+------+----------+----------+---------
    8800 |       0 |   0 |    0 |   0 |      0 |       0 |      800 |         800 |      3800 |     8800 |   0 |    1 | MAAAAA   | AAAAAA   | AAAAxx
    1891 |       1 |   1 |    3 |   1 |     11 |      91 |      891 |        1891 |      1891 |     1891 | 182 |  183 | TUAAAA   | BAAAAA   | HHHHxx
    3420 |       2 |   0 |    0 |   0 |      0 |      20 |      420 |        1420 |      3420 |     3420 |  40 |   41 | OBAAAA   | CAAAAA   | OOOOxx
    9850 |       3 |   0 |    2 |   0 |     10 |      50 |      850 |        1850 |      4850 |     9850 | 100 |  101 | WOAAAA   | DAAAAA   | VVVVxx
    7164 |       4 |   0 |    0 |   4 |      4 |      64 |      164 |        1164 |      2164 |     7164 | 128 |  129 | OPAAAA   | EAAAAA   | AAAAxx
    8009 |       5 |   1 |    1 |   9 |      9 |       9 |        9 |           9 |      3009 |     8009 |  18 |   19 | BWAAAA   | FAAAAA   | HHHHxx
    5057 |       6 |   1 |    1 |   7 |     17 |      57 |       57 |        1057 |        57 |     5057 | 114 |  115 | NMAAAA   | GAAAAA   | OOOOxx
(7 rows)

FETCH 8 in foo8;
 unique1 | unique2 | two | four | ten | twenty | hundred | thousand | twothousand | fivethous | tenthous | odd | even | stringu1 | stringu2 | string4 
---------+---------+-----+------+-----+--------+---------+----------+-------------+-----------+----------+-----+------+----------+----------+---------
    8800 |       0 |   0 |    0 |   0 |      0 |       0 |      800 |         800 |      3800 |     8800 |   0 |    1 | MAAAAA   | AAAAAA   | AAAAxx
    1891 |       1 |   1 |    3 |   1 |     11 |      91 |      891 |        1891 |      1891 |     1891 | 182 |  183 | TUAAAA   | BAAAAA   | HHHHxx
    3420 |       2 |   0 |    0 |   0 |      0 |      20 |      420 |        1420 |      3420 |     3420 |  40 |   41 | OBAAAA   | CAAAAA   | OOOOxx
    9850 |       3 |   0 |    2 |   0 |     10 |      50 |      850 |        1850 |      4850 |     9850 | 100 |  101 | WOAAAA   | DAAAAA   | VVVVxx
    7164 |       4 |   0 |    0 |   4 |      4 |      64 |      164 |        1164 |      2164 |     7164 | 128 |  129 | OPAAAA   | EAAAAA   | AAAAxx
    8009 |       5 |   1 |    1 |   9 |      9 |       9 |        9 |           9 |      3009 |     8009 |  18 |   19 | BWAAAA   | FAAAAA   | HHHHxx
    5057 |       6 |   1 |    1 |   7 |     17 |      57 |       57 |        1057 |        57 |     5057 | 114 |  115 | NMAAAA   | GAAAAA   | OOOOxx
    6701 |       7 |   1 |    1 |   1 |      1 |       1 |      701 |         701 |      1701 |     6701 |   2 |    3 | TXAAAA   | HAAAAA   | VVVVxx
(8 rows)

FETCH 9 in foo9;
 unique1 | unique2 | two | four | ten | twenty | hundred | thousand | twothousand | fivethous | tenthous | odd | even | stringu1 | stringu2 | string4 
---------+---------+-----+------+-----+--------+---------+----------+-------------+-----------+----------+-----+------+----------+----------+---------
    8800 |       0 |   0 |    0 |   0 |      0 |       0 |      800 |         800 |      3800 |     8800 |   0 |    1 | MAAAAA   | AAAAAA   | AAAAxx
    1891 |       1 |   1 |    3 |   1 |     11 |      91 |      891 |        1891 |      1891 |     1891 | 182 |  183 | TUAAAA   | BAAAAA   | HHHHxx
    3420 |       2 |   0 |    0 |   0 |      0 |      20 |      420 |        1420 |      3420 |     3420 |  40 |   41 | OBAAAA   | CAAAAA   | OOOOxx
    9850 |       3 |   0 |    2 |   0 |     10 |      50 |      850 |        1850 |      4850 |     9850 | 100 |  101 | WOAAAA   | DAAAAA   | VVVVxx
    7164 |       4 |   0 |    0 |   4 |      4 |      64 |      164 |        1164 |      2164 |     7164 | 128 |  129 | OPAAAA   | EAAAAA   | AAAAxx
    8009 |       5 |   1 |    1 |   9 |      9 |       9 |        9 |           9 |      3009 |     8009 |  18 |   19 | BWAAAA   | FAAAAA   | HHHHxx
    5057 |       6 |   1 |    1 |   7 |     17 |      57 |       57 |        1057 |        57 |     5057 | 114 |  115 | NMAAAA   | GAAAAA   | OOOOxx
    6701 |       7 |   1 |    1 |   1 |      1 |       1 |      701 |         701 |      1701 |     6701 |   2 |    3 | TXAAAA   | HAAAAA   | VVVVxx
    4321 |       8 |   1 |    1 |   1 |      1 |      21 |      321 |         321 |      4321 |     4321 |  42 |   43 | FKAAAA   | IAAAAA   | AAAAxx
(9 rows)

FETCH 10 in foo10;
 unique1 | unique2 | two | four | ten | twenty | hundred | thousand | twothousand | fivethous | tenthous | odd | even | stringu1 | stringu2 | string4 
---------+---------+-----+------+-----+--------+---------+----------+-------------+-----------+----------+-----+------+----------+----------+---------
    8800 |       0 |   0 |    0 |   0 |      0 |       0 |      800 |         800 |      3800 |     8800 |   0 |    1 | MAAAAA   | AAAAAA   | AAAAxx
    1891 |       1 |   1 |    3 |   1 |     11 |      91 |      891 |        1891 |      1891 |     1891 | 182 |  183 | TUAAAA   | BAAAAA   | HHHHxx
    3420 |       2 |   0 |    0 |   0 |      0 |      20 |      420 |        1420 |      3420 |     3420 |  40 |   41 | OBAAAA   | CAAAAA   | OOOOxx
    9850 |       3 |   0 |    2 |   0 |     10 |      50 |      850 |        1850 |      4850 |     9850 | 100 |  101 | WOAAAA   | DAAAAA   | VVVVxx
    7164 |       4 |   0 |    0 |   4 |      4 |      64 |      164 |        1164 |      2164 |     7164 | 128 |  129 | OPAAAA   | EAAAAA   | AAAAxx
    8009 |       5 |   1 |    1 |   9 |      9 |       9 |        9 |           9 |      3009 |     8009 |  18 |   19 | BWAAAA   | FAAAAA   | HHHHxx
    5057 |       6 |   1 |    1 |   7 |     17 |      57 |       57 |        1057 |        57 |     5057 | 114 |  115 | NMAAAA   | GAAAAA   | OOOOxx
    6701 |       7 |   1 |    1 |   1 |      1 |       1 |      701 |         701 |      1701 |     6701 |   2 |    3 | TXAAAA   | HAAAAA   | VVVVxx
    4321 |       8 |   1 |    1 |   1 |      1 |      21 |      321 |         321 |      4321 |     4321 |  42 |   43 | FKAAAA   | IAAAAA   | AAAAxx
    3043 |       9 |   1 |    3 |   3 |      3 |      43 |       43 |        1043 |      3043 |     3043 |  86 |   87 | BNAAAA   | JAAAAA   | HHHHxx
(10 rows)

FETCH 11 in foo11;
 unique1 | unique2 | two | four | ten | twenty | hundred | thousand | twothousand | fivethous | tenthous | odd | even | stringu1 | stringu2 | string4 
---------+---------+-----+------+-----+--------+---------+----------+-------------+-----------+----------+-----+------+----------+----------+---------
    8800 |       0 |   0 |    0 |   0 |      0 |       0 |      800 |         800 |      3800 |     8800 |   0 |    1 | MAAAAA   | AAAAAA   | AAAAxx
    1891 |       1 |   1 |    3 |   1 |     11 |      91 |      891 |        1891 |      1891 |     1891 | 182 |  183 | TUAAAA   | BAAAAA   | HHHHxx
    3420 |       2 |   0 |    0 |   0 |      0 |      20 |      420 |        1420 |      3420 |     3420 |  40 |   41 | OBAAAA   | CAAAAA   | OOOOxx
    9850 |       3 |   0 |    2 |   0 |     10 |      50 |      850 |        1850 |      4850 |     9850 | 100 |  101 | WOAAAA   | DAAAAA   | VVVVxx
    7164 |       4 |   0 |    0 |   4 |      4 |      64 |      164 |        1164 |      2164 |     7164 | 128 |  129 | OPAAAA   | EAAAAA   | AAAAxx
    8009 |       5 |   1 |    1 |   9 |      9 |       9 |        9 |           9 |      3009 |     8009 |  18 |   19 | BWAAAA   | FAAAAA   | HHHHxx
    5057 |       6 |   1 |    1 |   7 |     17 |      57 |       57 |        1057 |        57 |     5057 | 114 |  115 | NMAAAA   | GAAAAA   | OOOOxx
    6701 |       7 |   1 |    1 |   1 |      1 |       1 |      701 |         701 |      1701 |     6701 |   2 |    3 | TXAAAA   | HAAAAA   | VVVVxx
    4321 |       8 |   1 |    1 |   1 |      1 |      21 |      321 |         321 |      4321 |     4321 |  42 |   43 | FKAAAA   | IAAAAA   | AAAAxx
    3043 |       9 |   1 |    3 |   3 |      3 |      43 |       43 |        1043 |      3043 |     3043 |  86 |   87 | BNAAAA   | JAAAAA   | HHHHxx
    1314 |      10 |   0 |    2 |   4 |     14 |      14 |      314 |        1314 |      1314 |     1314 |  28 |   29 | OYAAAA   | KAAAAA   | OOOOxx
(11 rows)

FETCH 12 in foo12;
 unique1 | unique2 | two | four | ten | twenty | hundred | thousand | twothousand | fivethous | tenthous | odd | even | stringu1 | stringu2 | string4 
---------+---------+-----+------+-----+--------+---------+----------+-------------+-----------+----------+-----+------+----------+----------+---------
    8800 |       0 |   0 |    0 |   0 |      0 |       0 |      800 |         800 |      3800 |     8800 |   0 |    1 | MAAAAA   | AAAAAA   | AAAAxx
    1891 |       1 |   1 |    3 |   1 |     11 |      91 |      891 |        1891 |      1891 |     1891 | 182 |  183 | TUAAAA   | BAAAAA   | HHHHxx
    3420 |       2 |   0 |    0 |   0 |      0 |      20 |      420 |        1420 |      3420 |     3420 |  40 |   41 | OBAAAA   | CAAAAA   | OOOOxx
    9850 |       3 |   0 |    2 |   0 |     10 |      50 |      850 |        1850 |      4850 |     9850 | 100 |  101 | WOAAAA   | DAAAAA   | VVVVxx
    7164 |       4 |   0 |    0 |   4 |      4 |      64 |      164 |        1164 |      2164 |     7164 | 128 |  129 | OPAAAA   | EAAAAA   | AAAAxx
    8009 |       5 |   1 |    1 |   9 |      9 |       9 |        9 |           9 |      3009 |     8009 |  18 |   19 | BWAAAA   | FAAAAA   | HHHHxx
    5057 |       6 |   1 |    1 |   7 |     17 |      57 |       57 |        1057 |        57 |     5057 | 114 |  115 | NMAAAA   | GAAAAA   | OOOOxx
    6701 |       7 |   1 |    1 |   1 |      1 |       1 |      701 |         701 |      1701 |     6701 |   2 |    3 | TXAAAA   | HAAAAA   | VVVVxx
    4321 |       8 |   1 |    1 |   1 |      1 |      21 |      321 |         321 |      4321 |     4321 |  42 |   43 | FKAAAA   | IAAAAA   | AAAAxx
    3043 |       9 |   1 |    3 |   3 |      3 |      43 |       43 |        1043 |      3043 |     3043 |  86 |   87 | BNAAAA   | JAAAAA   | HHHHxx
    1314 |      10 |   0 |    2 |   4 |     14 |      14 |      314 |        1314 |      1314 |     1314 |  28 |   29 | OYAAAA   | KAAAAA   | OOOOxx
    1504 |      11 |   0 |    0 |   4 |      4 |       4 |      504 |        1504 |      1504 |     1504 |   8 |    9 | WFAAAA   | LAAAAA   | VVVVxx
(12 rows)

FETCH 13 in foo13;
 unique1 | unique2 | two | four | ten | twenty | hundred | thousand | twothousand | fivethous | tenthous | odd | even | stringu1 | stringu2 | string4 
---------+---------+-----+------+-----+--------+---------+----------+-------------+-----------+----------+-----+------+----------+----------+---------
    8800 |       0 |   0 |    0 |   0 |      0 |       0 |      800 |         800 |      3800 |     8800 |   0 |    1 | MAAAAA   | AAAAAA   | AAAAxx
    1891 |       1 |   1 |    3 |   1 |     11 |      91 |      891 |        1891 |      1891 |     1891 | 182 |  183 | TUAAAA   | BAAAAA   | HHHHxx
    3420 |       2 |   0 |    0 |   0 |      0 |      20 |      420 |        1420 |      3420 |     3420 |  40 |   41 | OBAAAA   | CAAAAA   | OOOOxx
    9850 |       3 |   0 |    2 |   0 |     10 |      50 |      850 |        1850 |      4850 |     9850 | 100 |  101 | WOAAAA   | DAAAAA   | VVVVxx
    7164 |       4 |   0 |    0 |   4 |      4 |      64 |      164 |        1164 |      2164 |     7164 | 128 |  129 | OPAAAA   | EAAAAA   | AAAAxx
    8009 |       5 |   1 |    1 |   9 |      9 |       9 |        9 |           9 |      3009 |     8009 |  18 |   19 | BWAAAA   | FAAAAA   | HHHHxx
    5057 |       6 |   1 |    1 |   7 |     17 |      57 |       57 |        1057 |        57 |     5057 | 114 |  115 | NMAAAA   | GAAAAA   | OOOOxx
    6701 |       7 |   1 |    1 |   1 |      1 |       1 |      701 |         701 |      1701 |     6701 |   2 |    3 | TXAAAA   | HAAAAA   | VVVVxx
    4321 |       8 |   1 |    1 |   1 |      1 |      21 |      321 |         321 |      4321 |     4321 |  42 |   43 | FKAAAA   | IAAAAA   | AAAAxx
    3043 |       9 |   1 |    3 |   3 |      3 |      43 |       43 |        1043 |      3043 |     3043 |  86 |   87 | BNAAAA   | JAAAAA   | HHHHxx
    1314 |      10 |   0 |    2 |   4 |     14 |      14 |      314 |        1314 |      1314 |     1314 |  28 |   29 | OYAAAA   | KAAAAA   | OOOOxx
    1504 |      11 |   0 |    0 |   4 |      4 |       4 |      504 |        1504 |      1504 |     1504 |   8 |    9 | WFAAAA   | LAAAAA   | VVVVxx
    5222 |      12 |   0 |    2 |   2 |      2 |      22 |      222 |        1222 |       222 |     5222 |  44 |   45 | WSAAAA   | MAAAAA   | AAAAxx
(13 rows)

FETCH 14 in foo14;
 unique1 | unique2 | two | four | ten | twenty | hundred | thousand | twothousand | fivethous | tenthous | odd | even | stringu1 | stringu2 | string4 
---------+---------+-----+------+-----+--------+---------+----------+-------------+-----------+----------+-----+------+----------+----------+---------
    8800 |       0 |   0 |    0 |   0 |      0 |       0 |      800 |         800 |      3800 |     8800 |   0 |    1 | MAAAAA   | AAAAAA   | AAAAxx
    1891 |       1 |   1 |    3 |   1 |     11 |      91 |      891 |        1891 |      1891 |     1891 | 182 |  183 | TUAAAA   | BAAAAA   | HHHHxx
    3420 |       2 |   0 |    0 |   0 |      0 |      20 |      420 |        1420 |      3420 |     3420 |  40 |   41 | OBAAAA   | CAAAAA   | OOOOxx
    9850 |       3 |   0 |    2 |   0 |     10 |      50 |      850 |        1850 |      4850 |     9850 | 100 |  101 | WOAAAA   | DAAAAA   | VVVVxx
    7164 |       4 |   0 |    0 |   4 |      4 |      64 |      164 |        1164 |      2164 |     7164 | 128 |  129 | OPAAAA   | EAAAAA   | AAAAxx
    8009 |       5 |   1 |    1 |   9 |      9 |       9 |        9 |           9 |      3009 |     8009 |  18 |   19 | BWAAAA   | FAAAAA   | HHHHxx
    5057 |       6 |   1 |    1 |   7 |     17 |      57 |       57 |        1057 |        57 |     5057 | 114 |  115 | NMAAAA   | GAAAAA   | OOOOxx
    6701 |       7 |   1 |    1 |   1 |      1 |       1 |      701 |         701 |      1701 |     6701 |   2 |    3 | TXAAAA   | HAAAAA   | VVVVxx
    4321 |       8 |   1 |    1 |   1 |      1 |      21 |      321 |         321 |      4321 |     4321 |  42 |   43 | FKAAAA   | IAAAAA   | AAAAxx
    3043 |       9 |   1 |    3 |   3 |      3 |      43 |       43 |        1043 |      3043 |     3043 |  86 |   87 | BNAAAA   | JAAAAA   | HHHHxx
    1314 |      10 |   0 |    2 |   4 |     14 |      14 |      314 |        1314 |      1314 |     1314 |  28 |   29 | OYAAAA   | KAAAAA   | OOOOxx
    1504 |      11 |   0 |    0 |   4 |      4 |       4 |      504 |        1504 |      1504 |     1504 |   8 |    9 | WFAAAA   | LAAAAA   | VVVVxx
    5222 |      12 |   0 |    2 |   2 |      2 |      22 |      222 |        1222 |       222 |     5222 |  44 |   45 | WSAAAA   | MAAAAA   | AAAAxx
    6243 |      13 |   1 |    3 |   3 |      3 |      43 |      243 |         243 |      1243 |     6243 |  86 |   87 | DGAAAA   | NAAAAA   | HHHHxx
(14 rows)

FETCH 15 in foo15;
 unique1 | unique2 | two | four | ten | twenty | hundred | thousand | twothousand | fivethous | tenthous | odd | even | stringu1 | stringu2 | string4 
---------+---------+-----+------+-----+--------+---------+----------+-------------+-----------+----------+-----+------+----------+----------+---------
    8800 |       0 |   0 |    0 |   0 |      0 |       0 |      800 |         800 |      3800 |     8800 |   0 |    1 | MAAAAA   | AAAAAA   | AAAAxx
    1891 |       1 |   1 |    3 |   1 |     11 |      91 |      891 |        1891 |      1891 |     1891 | 182 |  183 | TUAAAA   | BAAAAA   | HHHHxx
    3420 |       2 |   0 |    0 |   0 |      0 |      20 |      420 |        1420 |      3420 |     3420 |  40 |   41 | OBAAAA   | CAAAAA   | OOOOxx
    9850 |       3 |   0 |    2 |   0 |     10 |      50 |      850 |        1850 |      4850 |     9850 | 100 |  101 | WOAAAA   | DAAAAA   | VVVVxx
    7164 |       4 |   0 |    0 |   4 |      4 |      64 |      164 |        1164 |      2164 |     7164 | 128 |  129 | OPAAAA   | EAAAAA   | AAAAxx
    8009 |       5 |   1 |    1 |   9 |      9 |       9 |        9 |           9 |      3009 |     8009 |  18 |   19 | BWAAAA   | FAAAAA   | HHHHxx
    5057 |       6 |   1 |    1 |   7 |     17 |      57 |       57 |        1057 |        57 |     5057 | 114 |  115 | NMAAAA   | GAAAAA   | OOOOxx
    6701 |       7 |   1 |    1 |   1 |      1 |       1 |      701 |         701 |      1701 |     6701 |   2 |    3 | TXAAAA   | HAAAAA   | VVVVxx
    4321 |       8 |   1 |    1 |   1 |      1 |      21 |      321 |         321 |      4321 |     4321 |  42 |   43 | FKAAAA   | IAAAAA   | AAAAxx
    3043 |       9 |   1 |    3 |   3 |      3 |      43 |       43 |        1043 |      3043 |     3043 |  86 |   87 | BNAAAA   | JAAAAA   | HHHHxx
    1314 |      10 |   0 |    2 |   4 |     14 |      14 |      314 |        1314 |      1314 |     1314 |  28 |   29 | OYAAAA   | KAAAAA   | OOOOxx
    1504 |      11 |   0 |    0 |   4 |      4 |       4 |      504 |        1504 |      1504 |     1504 |   8 |    9 | WFAAAA   | LAAAAA   | VVVVxx
    5222 |      12 |   0 |    2 |   2 |      2 |      22 |      222 |        1222 |       222 |     5222 |  44 |   45 | WSAAAA   | MAAAAA   | AAAAxx
    6243 |      13 |   1 |    3 |   3 |      3 |      43 |      243 |         243 |      1243 |     6243 |  86 |   87 | DGAAAA   | NAAAAA   | HHHHxx
    5471 |      14 |   1 |    3 |   1 |     11 |      71 |      471 |        1471 |       471 |     5471 | 142 |  143 | LCAAAA   | OAAAAA   | OOOOxx
(15 rows)

FETCH 16 in foo16;
 unique1 | unique2 | two | four | ten | twenty | hundred | thousand | twothousand | fivethous | tenthous | odd | even | stringu1 | stringu2 | string4 
---------+---------+-----+------+-----+--------+---------+----------+-------------+-----------+----------+-----+------+----------+----------+---------
    8800 |       0 |   0 |    0 |   0 |      0 |       0 |      800 |         800 |      3800 |     8800 |   0 |    1 | MAAAAA   | AAAAAA   | AAAAxx
    1891 |       1 |   1 |    3 |   1 |     11 |      91 |      891 |        1891 |      1891 |     1891 | 182 |  183 | TUAAAA   | BAAAAA   | HHHHxx
    3420 |       2 |   0 |    0 |   0 |      0 |      20 |      420 |        1420 |      3420 |     3420 |  40 |   41 | OBAAAA   | CAAAAA   | OOOOxx
    9850 |       3 |   0 |    2 |   0 |     10 |      50 |      850 |        1850 |      4850 |     9850 | 100 |  101 | WOAAAA   | DAAAAA   | VVVVxx
    7164 |       4 |   0 |    0 |   4 |      4 |      64 |      164 |        1164 |      2164 |     7164 | 128 |  129 | OPAAAA   | EAAAAA   | AAAAxx
    8009 |       5 |   1 |    1 |   9 |      9 |       9 |        9 |           9 |      3009 |     8009 |  18 |   19 | BWAAAA   | FAAAAA   | HHHHxx
    5057 |       6 |   1 |    1 |   7 |     17 |      57 |       57 |        1057 |        57 |     5057 | 114 |  115 | NMAAAA   | GAAAAA   | OOOOxx
    6701 |       7 |   1 |    1 |   1 |      1 |       1 |      701 |         701 |      1701 |     6701 |   2 |    3 | TXAAAA   | HAAAAA   | VVVVxx
    4321 |       8 |   1 |    1 |   1 |      1 |      21 |      321 |         321 |      4321 |     4321 |  42 |   43 | FKAAAA   | IAAAAA   | AAAAxx
    3043 |       9 |   1 |    3 |   3 |      3 |      43 |       43 |        1043 |      3043 |     3043 |  86 |   87 | BNAAAA   | JAAAAA   | HHHHxx
    1314 |      10 |   0 |    2 |   4 |     14 |      14 |      314 |        1314 |      1314 |     1314 |  28 |   29 | OYAAAA   | KAAAAA   | OOOOxx
    1504 |      11 |   0 |    0 |   4 |      4 |       4 |      504 |        1504 |      1504 |     1504 |   8 |    9 | WFAAAA   | LAAAAA   | VVVVxx
    5222 |      12 |   0 |    2 |   2 |      2 |      22 |      222 |        1222 |       222 |     5222 |  44 |   45 | WSAAAA   | MAAAAA   | AAAAxx
    6243 |      13 |   1 |    3 |   3 |      3 |      43 |      243 |         243 |      1243 |     6243 |  86 |   87 | DGAAAA   | NAAAAA   | HHHHxx
    5471 |      14 |   1 |    3 |   1 |     11 |      71 |      471 |        1471 |       471 |     5471 | 142 |  143 | LCAAAA   | OAAAAA   | OOOOxx
    5006 |      15 |   0 |    2 |   6 |      6 |       6 |        6 |        1006 |         6 |     5006 |  12 |   13 | OKAAAA   | PAAAAA   | VVVVxx
(16 rows)

FETCH 17 in foo17;
 unique1 | unique2 | two | four | ten | twenty | hundred | thousand | twothousand | fivethous | tenthous | odd | even | stringu1 | stringu2 | string4 
---------+---------+-----+------+-----+--------+---------+----------+-------------+-----------+----------+-----+------+----------+----------+---------
    8800 |       0 |   0 |    0 |   0 |      0 |       0 |      800 |         800 |      3800 |     8800 |   0 |    1 | MAAAAA   | AAAAAA   | AAAAxx
    1891 |       1 |   1 |    3 |   1 |     11 |      91 |      891 |        1891 |      1891 |     1891 | 182 |  183 | TUAAAA   | BAAAAA   | HHHHxx
    3420 |       2 |   0 |    0 |   0 |      0 |      20 |      420 |        1420 |      3420 |     3420 |  40 |   41 | OBAAAA   | CAAAAA   | OOOOxx
    9850 |       3 |   0 |    2 |   0 |     10 |      50 |      850 |        1850 |      4850 |     9850 | 100 |  101 | WOAAAA   | DAAAAA   | VVVVxx
    7164 |       4 |   0 |    0 |   4 |      4 |      64 |      164 |        1164 |      2164 |     7164 | 128 |  129 | OPAAAA   | EAAAAA   | AAAAxx
    8009 |       5 |   1 |    1 |   9 |      9 |       9 |        9 |           9 |      3009 |     8009 |  18 |   19 | BWAAAA   | FAAAAA   | HHHHxx
    5057 |       6 |   1 |    1 |   7 |     17 |      57 |       57 |        1057 |        57 |     5057 | 114 |  115 | NMAAAA   | GAAAAA   | OOOOxx
    6701 |       7 |   1 |    1 |   1 |      1 |       1 |      701 |         701 |      1701 |     6701 |   2 |    3 | TXAAAA   | HAAAAA   | VVVVxx
    4321 |       8 |   1 |    1 |   1 |      1 |      21 |      321 |         321 |      4321 |     4321 |  42 |   43 | FKAAAA   | IAAAAA   | AAAAxx
    3043 |       9 |   1 |    3 |   3 |      3 |      43 |       43 |        1043 |      3043 |     3043 |  86 |   87 | BNAAAA   | JAAAAA   | HHHHxx
    1314 |      10 |   0 |    2 |   4 |     14 |      14 |      314 |        1314 |      1314 |     1314 |  28 |   29 | OYAAAA   | KAAAAA   | OOOOxx
    1504 |      11 |   0 |    0 |   4 |      4 |       4 |      504 |        1504 |      1504 |     1504 |   8 |    9 | WFAAAA   | LAAAAA   | VVVVxx
    5222 |      12 |   0 |    2 |   2 |      2 |      22 |      222 |        1222 |       222 |     5222 |  44 |   45 | WSAAAA   | MAAAAA   | AAAAxx
    6243 |      13 |   1 |    3 |   3 |      3 |      43 |      243 |         243 |      1243 |     6243 |  86 |   87 | DGAAAA   | NAAAAA   | HHHHxx
    5471 |      14 |   1 |    3 |   1 |     11 |      71 |      471 |        1471 |       471 |     5471 | 142 |  143 | LCAAAA   | OAAAAA   | OOOOxx
    5006 |      15 |   0 |    2 |   6 |      6 |       6 |        6 |        1006 |         6 |     5006 |  12 |   13 | OKAAAA   | PAAAAA   | VVVVxx
    5387 |      16 |   1 |    3 |   7 |      7 |      87 |      387 |        1387 |       387 |     5387 | 174 |  175 | FZAAAA   | QAAAAA   | AAAAxx
(17 rows)

FETCH 18 in foo18;
 unique1 | unique2 | two | four | ten | twenty | hundred | thousand | twothousand | fivethous | tenthous | odd | even | stringu1 | stringu2 | string4 
---------+---------+-----+------+-----+--------+---------+----------+-------------+-----------+----------+-----+------+----------+----------+---------
    8800 |       0 |   0 |    0 |   0 |      0 |       0 |      800 |         800 |      3800 |     8800 |   0 |    1 | MAAAAA   | AAAAAA   | AAAAxx
    1891 |       1 |   1 |    3 |   1 |     11 |      91 |      891 |        1891 |      1891 |     1891 | 182 |  183 | TUAAAA   | BAAAAA   | HHHHxx
    3420 |       2 |   0 |    0 |   0 |      0 |      20 |      420 |        1420 |      3420 |     3420 |  40 |   41 | OBAAAA   | CAAAAA   | OOOOxx
    9850 |       3 |   0 |    2 |   0 |     10 |      50 |      850 |        1850 |      4850 |     9850 | 100 |  101 | WOAAAA   | DAAAAA   | VVVVxx
    7164 |       4 |   0 |    0 |   4 |      4 |      64 |      164 |        1164 |      2164 |     7164 | 128 |  129 | OPAAAA   | EAAAAA   | AAAAxx
    8009 |       5 |   1 |    1 |   9 |      9 |       9 |        9 |           9 |      3009 |     8009 |  18 |   19 | BWAAAA   | FAAAAA   | HHHHxx
    5057 |       6 |   1 |    1 |   7 |     17 |      57 |       57 |        1057 |        57 |     5057 | 114 |  115 | NMAAAA   | GAAAAA   | OOOOxx
    6701 |       7 |   1 |    1 |   1 |      1 |       1 |      701 |         701 |      1701 |     6701 |   2 |    3 | TXAAAA   | HAAAAA   | VVVVxx
    4321 |       8 |   1 |    1 |   1 |      1 |      21 |      321 |         321 |      4321 |     4321 |  42 |   43 | FKAAAA   | IAAAAA   | AAAAxx
    3043 |       9 |   1 |    3 |   3 |      3 |      43 |       43 |        1043 |      3043 |     3043 |  86 |   87 | BNAAAA   | JAAAAA   | HHHHxx
    1314 |      10 |   0 |    2 |   4 |     14 |      14 |      314 |        1314 |      1314 |     1314 |  28 |   29 | OYAAAA   | KAAAAA   | OOOOxx
    1504 |      11 |   0 |    0 |   4 |      4 |       4 |      504 |        1504 |      1504 |     1504 |   8 |    9 | WFAAAA   | LAAAAA   | VVVVxx
    5222 |      12 |   0 |    2 |   2 |      2 |      22 |      222 |        1222 |       222 |     5222 |  44 |   45 | WSAAAA   | MAAAAA   | AAAAxx
    6243 |      13 |   1 |    3 |   3 |      3 |      43 |      243 |         243 |      1243 |     6243 |  86 |   87 | DGAAAA   | NAAAAA   | HHHHxx
    5471 |      14 |   1 |    3 |   1 |     11 |      71 |      471 |        1471 |       471 |     5471 | 142 |  143 | LCAAAA   | OAAAAA   | OOOOxx
    5006 |      15 |   0 |    2 |   6 |      6 |       6 |        6 |        1006 |         6 |     5006 |  12 |   13 | OKAAAA   | PAAAAA   | VVVVxx
    5387 |      16 |   1 |    3 |   7 |      7 |      87 |      387 |        1387 |       387 |     5387 | 174 |  175 | FZAAAA   | QAAAAA   | AAAAxx
    5785 |      17 |   1 |    1 |   5 |      5 |      85 |      785 |        1785 |       785 |     5785 | 170 |  171 | NOAAAA   | RAAAAA   | HHHHxx
(18 rows)

FETCH 19 in foo19;
 unique1 | unique2 | two | four | ten | twenty | hundred | thousand | twothousand | fivethous | tenthous | odd | even | stringu1 | stringu2 | string4 
---------+---------+-----+------+-----+--------+---------+----------+-------------+-----------+----------+-----+------+----------+----------+---------
    8800 |       0 |   0 |    0 |   0 |      0 |       0 |      800 |         800 |      3800 |     8800 |   0 |    1 | MAAAAA   | AAAAAA   | AAAAxx
    1891 |       1 |   1 |    3 |   1 |     11 |      91 |      891 |        1891 |      1891 |     1891 | 182 |  183 | TUAAAA   | BAAAAA   | HHHHxx
    3420 |       2 |   0 |    0 |   0 |      0 |      20 |      420 |        1420 |      3420 |     3420 |  40 |   41 | OBAAAA   | CAAAAA   | OOOOxx
    9850 |       3 |   0 |    2 |   0 |     10 |      50 |      850 |        1850 |      4850 |     9850 | 100 |  101 | WOAAAA   | DAAAAA   | VVVVxx
    7164 |       4 |   0 |    0 |   4 |      4 |      64 |      164 |        1164 |      2164 |     7164 | 128 |  129 | OPAAAA   | EAAAAA   | AAAAxx
    8009 |       5 |   1 |    1 |   9 |      9 |       9 |        9 |           9 |      3009 |     8009 |  18 |   19 | BWAAAA   | FAAAAA   | HHHHxx
    5057 |       6 |   1 |    1 |   7 |     17 |      57 |       57 |        1057 |        57 |     5057 | 114 |  115 | NMAAAA   | GAAAAA   | OOOOxx
    6701 |       7 |   1 |    1 |   1 |      1 |       1 |      701 |         701 |      1701 |     6701 |   2 |    3 | TXAAAA   | HAAAAA   | VVVVxx
    4321 |       8 |   1 |    1 |   1 |      1 |      21 |      321 |         321 |      4321 |     4321 |  42 |   43 | FKAAAA   | IAAAAA   | AAAAxx
    3043 |       9 |   1 |    3 |   3 |      3 |      43 |       43 |        1043 |      3043 |     3043 |  86 |   87 | BNAAAA   | JAAAAA   | HHHHxx
    1314 |      10 |   0 |    2 |   4 |     14 |      14 |      314 |        1314 |      1314 |     1314 |  28 |   29 | OYAAAA   | KAAAAA   | OOOOxx
    1504 |      11 |   0 |    0 |   4 |      4 |       4 |      504 |        1504 |      1504 |     1504 |   8 |    9 | WFAAAA   | LAAAAA   | VVVVxx
    5222 |      12 |   0 |    2 |   2 |      2 |      22 |      222 |        1222 |       222 |     5222 |  44 |   45 | WSAAAA   | MAAAAA   | AAAAxx
    6243 |      13 |   1 |    3 |   3 |      3 |      43 |      243 |         243 |      1243 |     6243 |  86 |   87 | DGAAAA   | NAAAAA   | HHHHxx
    5471 |      14 |   1 |    3 |   1 |     11 |      71 |      471 |        1471 |       471 |     5471 | 142 |  143 | LCAAAA   | OAAAAA   | OOOOxx
    5006 |      15 |   0 |    2 |   6 |      6 |       6 |        6 |        1006 |         6 |     5006 |  12 |   13 | OKAAAA   | PAAAAA   | VVVVxx
    5387 |      16 |   1 |    3 |   7 |      7 |      87 |      387 |        1387 |       387 |     5387 | 174 |  175 | FZAAAA   | QAAAAA   | AAAAxx
    5785 |      17 |   1 |    1 |   5 |      5 |      85 |      785 |        1785 |       785 |     5785 | 170 |  171 | NOAAAA   | RAAAAA   | HHHHxx
    6621 |      18 |   1 |    1 |   1 |      1 |      21 |      621 |         621 |      1621 |     6621 |  42 |   43 | RUAAAA   | SAAAAA   | OOOOxx
(19 rows)

FETCH 20 in foo20;
 unique1 | unique2 | two | four | ten | twenty | hundred | thousand | twothousand | fivethous | tenthous | odd | even | stringu1 | stringu2 | string4 
---------+---------+-----+------+-----+--------+---------+----------+-------------+-----------+----------+-----+------+----------+----------+---------
    8800 |       0 |   0 |    0 |   0 |      0 |       0 |      800 |         800 |      3800 |     8800 |   0 |    1 | MAAAAA   | AAAAAA   | AAAAxx
    1891 |       1 |   1 |    3 |   1 |     11 |      91 |      891 |        1891 |      1891 |     1891 | 182 |  183 | TUAAAA   | BAAAAA   | HHHHxx
    3420 |       2 |   0 |    0 |   0 |      0 |      20 |      420 |        1420 |      3420 |     3420 |  40 |   41 | OBAAAA   | CAAAAA   | OOOOxx
    9850 |       3 |   0 |    2 |   0 |     10 |      50 |      850 |        1850 |      4850 |     9850 | 100 |  101 | WOAAAA   | DAAAAA   | VVVVxx
    7164 |       4 |   0 |    0 |   4 |      4 |      64 |      164 |        1164 |      2164 |     7164 | 128 |  129 | OPAAAA   | EAAAAA   | AAAAxx
    8009 |       5 |   1 |    1 |   9 |      9 |       9 |        9 |           9 |      3009 |     8009 |  18 |   19 | BWAAAA   | FAAAAA   | HHHHxx
    5057 |       6 |   1 |    1 |   7 |     17 |      57 |       57 |        1057 |        57 |     5057 | 114 |  115 | NMAAAA   | GAAAAA   | OOOOxx
    6701 |       7 |   1 |    1 |   1 |      1 |       1 |      701 |         701 |      1701 |     6701 |   2 |    3 | TXAAAA   | HAAAAA   | VVVVxx
    4321 |       8 |   1 |    1 |   1 |      1 |      21 |      321 |         321 |      4321 |     4321 |  42 |   43 | FKAAAA   | IAAAAA   | AAAAxx
    3043 |       9 |   1 |    3 |   3 |      3 |      43 |       43 |        1043 |      3043 |     3043 |  86 |   87 | BNAAAA   | JAAAAA   | HHHHxx
    1314 |      10 |   0 |    2 |   4 |     14 |      14 |      314 |        1314 |      1314 |     1314 |  28 |   29 | OYAAAA   | KAAAAA   | OOOOxx
    1504 |      11 |   0 |    0 |   4 |      4 |       4 |      504 |        1504 |      1504 |     1504 |   8 |    9 | WFAAAA   | LAAAAA   | VVVVxx
    5222 |      12 |   0 |    2 |   2 |      2 |      22 |      222 |        1222 |       222 |     5222 |  44 |   45 | WSAAAA   | MAAAAA   | AAAAxx
    6243 |      13 |   1 |    3 |   3 |      3 |      43 |      243 |         243 |      1243 |     6243 |  86 |   87 | DGAAAA   | NAAAAA   | HHHHxx
    5471 |      14 |   1 |    3 |   1 |     11 |      71 |      471 |        1471 |       471 |     5471 | 142 |  143 | LCAAAA   | OAAAAA   | OOOOxx
    5006 |      15 |   0 |    2 |   6 |      6 |       6 |        6 |        1006 |         6 |     5006 |  12 |   13 | OKAAAA   | PAAAAA   | VVVVxx
    5387 |      16 |   1 |    3 |   7 |      7 |      87 |      387 |        1387 |       387 |     5387 | 174 |  175 | FZAAAA   | QAAAAA   | AAAAxx
    5785 |      17 |   1 |    1 |   5 |      5 |      85 |      785 |        1785 |       785 |     5785 | 170 |  171 | NOAAAA   | RAAAAA   | HHHHxx
    6621 |      18 |   1 |    1 |   1 |      1 |      21 |      621 |         621 |      1621 |     6621 |  42 |   43 | RUAAAA   | SAAAAA   | OOOOxx
    6969 |      19 |   1 |    1 |   9 |      9 |      69 |      969 |         969 |      1969 |     6969 | 138 |  139 | BIAAAA   | TAAAAA   | VVVVxx
(20 rows)

FETCH 21 in foo21;
 unique1 | unique2 | two | four | ten | twenty | hundred | thousand | twothousand | fivethous | tenthous | odd | even | stringu1 | stringu2 | string4 
---------+---------+-----+------+-----+--------+---------+----------+-------------+-----------+----------+-----+------+----------+----------+---------
    8800 |       0 |   0 |    0 |   0 |      0 |       0 |      800 |         800 |      3800 |     8800 |   0 |    1 | MAAAAA   | AAAAAA   | AAAAxx
    1891 |       1 |   1 |    3 |   1 |     11 |      91 |      891 |        1891 |      1891 |     1891 | 182 |  183 | TUAAAA   | BAAAAA   | HHHHxx
    3420 |       2 |   0 |    0 |   0 |      0 |      20 |      420 |        1420 |      3420 |     3420 |  40 |   41 | OBAAAA   | CAAAAA   | OOOOxx
    9850 |       3 |   0 |    2 |   0 |     10 |      50 |      850 |        1850 |      4850 |     9850 | 100 |  101 | WOAAAA   | DAAAAA   | VVVVxx
    7164 |       4 |   0 |    0 |   4 |      4 |      64 |      164 |        1164 |      2164 |     7164 | 128 |  129 | OPAAAA   | EAAAAA   | AAAAxx
    8009 |       5 |   1 |    1 |   9 |      9 |       9 |        9 |           9 |      3009 |     8009 |  18 |   19 | BWAAAA   | FAAAAA   | HHHHxx
    5057 |       6 |   1 |    1 |   7 |     17 |      57 |       57 |        1057 |        57 |     5057 | 114 |  115 | NMAAAA   | GAAAAA   | OOOOxx
    6701 |       7 |   1 |    1 |   1 |      1 |       1 |      701 |         701 |      1701 |     6701 |   2 |    3 | TXAAAA   | HAAAAA   | VVVVxx
    4321 |       8 |   1 |    1 |   1 |      1 |      21 |      321 |         321 |      4321 |     4321 |  42 |   43 | FKAAAA   | IAAAAA   | AAAAxx
    3043 |       9 |   1 |    3 |   3 |      3 |      43 |       43 |        1043 |      3043 |     3043 |  86 |   87 | BNAAAA   | JAAAAA   | HHHHxx
    1314 |      10 |   0 |    2 |   4 |     14 |      14 |      314 |        1314 |      1314 |     1314 |  28 |   29 | OYAAAA   | KAAAAA   | OOOOxx
    1504 |      11 |   0 |    0 |   4 |      4 |       4 |      504 |        1504 |      1504 |     1504 |   8 |    9 | WFAAAA   | LAAAAA   | VVVVxx
    5222 |      12 |   0 |    2 |   2 |      2 |      22 |      222 |        1222 |       222 |     5222 |  44 |   45 | WSAAAA   | MAAAAA   | AAAAxx
    6243 |      13 |   1 |    3 |   3 |      3 |      43 |      243 |         243 |      1243 |     6243 |  86 |   87 | DGAAAA   | NAAAAA   | HHHHxx
    5471 |      14 |   1 |    3 |   1 |     11 |      71 |      471 |        1471 |       471 |     5471 | 142 |  143 | LCAAAA   | OAAAAA   | OOOOxx
    5006 |      15 |   0 |    2 |   6 |      6 |       6 |        6 |        1006 |         6 |     5006 |  12 |   13 | OKAAAA   | PAAAAA   | VVVVxx
    5387 |      16 |   1 |    3 |   7 |      7 |      87 |      387 |        1387 |       387 |     5387 | 174 |  175 | FZAAAA   | QAAAAA   | AAAAxx
    5785 |      17 |   1 |    1 |   5 |      5 |      85 |      785 |        1785 |       785 |     5785 | 170 |  171 | NOAAAA   | RAAAAA   | HHHHxx
    6621 |      18 |   1 |    1 |   1 |      1 |      21 |      621 |         621 |      1621 |     6621 |  42 |   43 | RUAAAA   | SAAAAA   | OOOOxx
    6969 |      19 |   1 |    1 |   9 |      9 |      69 |      969 |         969 |      1969 |     6969 | 138 |  139 | BIAAAA   | TAAAAA   | VVVVxx
    9460 |      20 |   0 |    0 |   0 |      0 |      60 |      460 |        1460 |      4460 |     9460 | 120 |  121 | WZAAAA   | UAAAAA   | AAAAxx
(21 rows)

FETCH 22 in foo22;
 unique1 | unique2 | two | four | ten | twenty | hundred | thousand | twothousand | fivethous | tenthous | odd | even | stringu1 | stringu2 | string4 
---------+---------+-----+------+-----+--------+---------+----------+-------------+-----------+----------+-----+------+----------+----------+---------
    8800 |       0 |   0 |    0 |   0 |      0 |       0 |      800 |         800 |      3800 |     8800 |   0 |    1 | MAAAAA   | AAAAAA   | AAAAxx
    1891 |       1 |   1 |    3 |   1 |     11 |      91 |      891 |        1891 |      1891 |     1891 | 182 |  183 | TUAAAA   | BAAAAA   | HHHHxx
    3420 |       2 |   0 |    0 |   0 |      0 |      20 |      420 |        1420 |      3420 |     3420 |  40 |   41 | OBAAAA   | CAAAAA   | OOOOxx
    9850 |       3 |   0 |    2 |   0 |     10 |      50 |      850 |        1850 |      4850 |     9850 | 100 |  101 | WOAAAA   | DAAAAA   | VVVVxx
    7164 |       4 |   0 |    0 |   4 |      4 |      64 |      164 |        1164 |      2164 |     7164 | 128 |  129 | OPAAAA   | EAAAAA   | AAAAxx
    8009 |       5 |   1 |    1 |   9 |      9 |       9 |        9 |           9 |      3009 |     8009 |  18 |   19 | BWAAAA   | FAAAAA   | HHHHxx
    5057 |       6 |   1 |    1 |   7 |     17 |      57 |       57 |        1057 |        57 |     5057 | 114 |  115 | NMAAAA   | GAAAAA   | OOOOxx
    6701 |       7 |   1 |    1 |   1 |      1 |       1 |      701 |         701 |      1701 |     6701 |   2 |    3 | TXAAAA   | HAAAAA   | VVVVxx
    4321 |       8 |   1 |    1 |   1 |      1 |      21 |      321 |         321 |      4321 |     4321 |  42 |   43 | FKAAAA   | IAAAAA   | AAAAxx
    3043 |       9 |   1 |    3 |   3 |      3 |      43 |       43 |        1043 |      3043 |     3043 |  86 |   87 | BNAAAA   | JAAAAA   | HHHHxx
    1314 |      10 |   0 |    2 |   4 |     14 |      14 |      314 |        1314 |      1314 |     1314 |  28 |   29 | OYAAAA   | KAAAAA   | OOOOxx
    1504 |      11 |   0 |    0 |   4 |      4 |       4 |      504 |        1504 |      1504 |     1504 |   8 |    9 | WFAAAA   | LAAAAA   | VVVVxx
    5222 |      12 |   0 |    2 |   2 |      2 |      22 |      222 |        1222 |       222 |     5222 |  44 |   45 | WSAAAA   | MAAAAA   | AAAAxx
    6243 |      13 |   1 |    3 |   3 |      3 |      43 |      243 |         243 |      1243 |     6243 |  86 |   87 | DGAAAA   | NAAAAA   | HHHHxx
    5471 |      14 |   1 |    3 |   1 |     11 |      71 |      471 |        1471 |       471 |     5471 | 142 |  143 | LCAAAA   | OAAAAA   | OOOOxx
    5006 |      15 |   0 |    2 |   6 |      6 |       6 |        6 |        1006 |         6 |     5006 |  12 |   13 | OKAAAA   | PAAAAA   | VVVVxx
    5387 |      16 |   1 |    3 |   7 |      7 |      87 |      387 |        1387 |       387 |     5387 | 174 |  175 | FZAAAA   | QAAAAA   | AAAAxx
    5785 |      17 |   1 |    1 |   5 |      5 |      85 |      785 |        1785 |       785 |     5785 | 170 |  171 | NOAAAA   | RAAAAA   | HHHHxx
    6621 |      18 |   1 |    1 |   1 |      1 |      21 |      621 |         621 |      1621 |     6621 |  42 |   43 | RUAAAA   | SAAAAA   | OOOOxx
    6969 |      19 |   1 |    1 |   9 |      9 |      69 |      969 |         969 |      1969 |     6969 | 138 |  139 | BIAAAA   | TAAAAA   | VVVVxx
    9460 |      20 |   0 |    0 |   0 |      0 |      60 |      460 |        1460 |      4460 |     9460 | 120 |  121 | WZAAAA   | UAAAAA   | AAAAxx
      59 |      21 |   1 |    3 |   9 |     19 |      59 |       59 |          59 |        59 |       59 | 118 |  119 | HCAAAA   | VAAAAA   | HHHHxx
(22 rows)

FETCH 23 in foo23;
 unique1 | unique2 | two | four | ten | twenty | hundred | thousand | twothousand | fivethous | tenthous | odd | even | stringu1 | stringu2 | string4 
---------+---------+-----+------+-----+--------+---------+----------+-------------+-----------+----------+-----+------+----------+----------+---------
    8800 |       0 |   0 |    0 |   0 |      0 |       0 |      800 |         800 |      3800 |     8800 |   0 |    1 | MAAAAA   | AAAAAA   | AAAAxx
    1891 |       1 |   1 |    3 |   1 |     11 |      91 |      891 |        1891 |      1891 |     1891 | 182 |  183 | TUAAAA   | BAAAAA   | HHHHxx
    3420 |       2 |   0 |    0 |   0 |      0 |      20 |      420 |        1420 |      3420 |     3420 |  40 |   41 | OBAAAA   | CAAAAA   | OOOOxx
    9850 |       3 |   0 |    2 |   0 |     10 |      50 |      850 |        1850 |      4850 |     9850 | 100 |  101 | WOAAAA   | DAAAAA   | VVVVxx
    7164 |       4 |   0 |    0 |   4 |      4 |      64 |      164 |        1164 |      2164 |     7164 | 128 |  129 | OPAAAA   | EAAAAA   | AAAAxx
    8009 |       5 |   1 |    1 |   9 |      9 |       9 |        9 |           9 |      3009 |     8009 |  18 |   19 | BWAAAA   | FAAAAA   | HHHHxx
    5057 |       6 |   1 |    1 |   7 |     17 |      57 |       57 |        1057 |        57 |     5057 | 114 |  115 | NMAAAA   | GAAAAA   | OOOOxx
    6701 |       7 |   1 |    1 |   1 |      1 |       1 |      701 |         701 |      1701 |     6701 |   2 |    3 | TXAAAA   | HAAAAA   | VVVVxx
    4321 |       8 |   1 |    1 |   1 |      1 |      21 |      321 |         321 |      4321 |     4321 |  42 |   43 | FKAAAA   | IAAAAA   | AAAAxx
    3043 |       9 |   1 |    3 |   3 |      3 |      43 |       43 |        1043 |      3043 |     3043 |  86 |   87 | BNAAAA   | JAAAAA   | HHHHxx
    1314 |      10 |   0 |    2 |   4 |     14 |      14 |      314 |        1314 |      1314 |     1314 |  28 |   29 | OYAAAA   | KAAAAA   | OOOOxx
    1504 |      11 |   0 |    0 |   4 |      4 |       4 |      504 |        1504 |      1504 |     1504 |   8 |    9 | WFAAAA   | LAAAAA   | VVVVxx
    5222 |      12 |   0 |    2 |   2 |      2 |      22 |      222 |        1222 |       222 |     5222 |  44 |   45 | WSAAAA   | MAAAAA   | AAAAxx
    6243 |      13 |   1 |    3 |   3 |      3 |      43 |      243 |         243 |      1243 |     6243 |  86 |   87 | DGAAAA   | NAAAAA   | HHHHxx
    5471 |      14 |   1 |    3 |   1 |     11 |      71 |      471 |        1471 |       471 |     5471 | 142 |  143 | LCAAAA   | OAAAAA   | OOOOxx
    5006 |      15 |   0 |    2 |   6 |      6 |       6 |        6 |        1006 |         6 |     5006 |  12 |   13 | OKAAAA   | PAAAAA   | VVVVxx
    5387 |      16 |   1 |    3 |   7 |      7 |      87 |      387 |        1387 |       387 |     5387 | 174 |  175 | FZAAAA   | QAAAAA   | AAAAxx
    5785 |      17 |   1 |    1 |   5 |      5 |      85 |      785 |        1785 |       785 |     5785 | 170 |  171 | NOAAAA   | RAAAAA   | HHHHxx
    6621 |      18 |   1 |    1 |   1 |      1 |      21 |      621 |         621 |      1621 |     6621 |  42 |   43 | RUAAAA   | SAAAAA   | OOOOxx
    6969 |      19 |   1 |    1 |   9 |      9 |      69 |      969 |         969 |      1969 |     6969 | 138 |  139 | BIAAAA   | TAAAAA   | VVVVxx
    9460 |      20 |   0 |    0 |   0 |      0 |      60 |      460 |        1460 |      4460 |     9460 | 120 |  121 | WZAAAA   | UAAAAA   | AAAAxx
      59 |      21 |   1 |    3 |   9 |     19 |      59 |       59 |          59 |        59 |       59 | 118 |  119 | HCAAAA   | VAAAAA   | HHHHxx
    8020 |      22 |   0 |    0 |   0 |      0 |      20 |       20 |          20 |      3020 |     8020 |  40 |   41 | MWAAAA   | WAAAAA   | OOOOxx
(23 rows)

FETCH backward 1 in foo23;
 unique1 | unique2 | two | four | ten | twenty | hundred | thousand | twothousand | fivethous | tenthous | odd | even | stringu1 | stringu2 | string4 
---------+---------+-----+------+-----+--------+---------+----------+-------------+-----------+----------+-----+------+----------+----------+---------
      59 |      21 |   1 |    3 |   9 |     19 |      59 |       59 |          59 |        59 |       59 | 118 |  119 | HCAAAA   | VAAAAA   | HHHHxx
(1 row)

FETCH backward 2 in foo22;
 unique1 | unique2 | two | four | ten | twenty | hundred | thousand | twothousand | fivethous | tenthous | odd | even | stringu1 | stringu2 | string4 
---------+---------+-----+------+-----+--------+---------+----------+-------------+-----------+----------+-----+------+----------+----------+---------
    9460 |      20 |   0 |    0 |   0 |      0 |      60 |      460 |        1460 |      4460 |     9460 | 120 |  121 | WZAAAA   | UAAAAA   | AAAAxx
    6969 |      19 |   1 |    1 |   9 |      9 |      69 |      969 |         969 |      1969 |     6969 | 138 |  139 | BIAAAA   | TAAAAA   | VVVVxx
(2 rows)

FETCH backward 3 in foo21;
 unique1 | unique2 | two | four | ten | twenty | hundred | thousand | twothousand | fivethous | tenthous | odd | even | stringu1 | stringu2 | string4 
---------+---------+-----+------+-----+--------+---------+----------+-------------+-----------+----------+-----+------+----------+----------+---------
    6969 |      19 |   1 |    1 |   9 |      9 |      69 |      969 |         969 |      1969 |     6969 | 138 |  139 | BIAAAA   | TAAAAA   | VVVVxx
    6621 |      18 |   1 |    1 |   1 |      1 |      21 |      621 |         621 |      1621 |     6621 |  42 |   43 | RUAAAA   | SAAAAA   | OOOOxx
    5785 |      17 |   1 |    1 |   5 |      5 |      85 |      785 |        1785 |       785 |     5785 | 170 |  171 | NOAAAA   | RAAAAA   | HHHHxx
(3 rows)

FETCH backward 4 in foo20;
 unique1 | unique2 | two | four | ten | twenty | hundred | thousand | twothousand | fivethous | tenthous | odd | even | stringu1 | stringu2 | string4 
---------+---------+-----+------+-----+--------+---------+----------+-------------+-----------+----------+-----+------+----------+----------+---------
    6621 |      18 |   1 |    1 |   1 |      1 |      21 |      621 |         621 |      1621 |     6621 |  42 |   43 | RUAAAA   | SAAAAA   | OOOOxx
    5785 |      17 |   1 |    1 |   5 |      5 |      85 |      785 |        1785 |       785 |     5785 | 170 |  171 | NOAAAA   | RAAAAA   | HHHHxx
    5387 |      16 |   1 |    3 |   7 |      7 |      87 |      387 |        1387 |       387 |     5387 | 174 |  175 | FZAAAA   | QAAAAA   | AAAAxx
    5006 |      15 |   0 |    2 |   6 |      6 |       6 |        6 |        1006 |         6 |     5006 |  12 |   13 | OKAAAA   | PAAAAA   | VVVVxx
(4 rows)

FETCH backward 5 in foo19;
 unique1 | unique2 | two | four | ten | twenty | hundred | thousand | twothousand | fivethous | tenthous | odd | even | stringu1 | stringu2 | string4 
---------+---------+-----+------+-----+--------+---------+----------+-------------+-----------+----------+-----+------+----------+----------+---------
    5785 |      17 |   1 |    1 |   5 |      5 |      85 |      785 |        1785 |       785 |     5785 | 170 |  171 | NOAAAA   | RAAAAA   | HHHHxx
    5387 |      16 |   1 |    3 |   7 |      7 |      87 |      387 |        1387 |       387 |     5387 | 174 |  175 | FZAAAA   | QAAAAA   | AAAAxx
    5006 |      15 |   0 |    2 |   6 |      6 |       6 |        6 |        1006 |         6 |     5006 |  12 |   13 | OKAAAA   | PAAAAA   | VVVVxx
    5471 |      14 |   1 |    3 |   1 |     11 |      71 |      471 |        1471 |       471 |     5471 | 142 |  143 | LCAAAA   | OAAAAA   | OOOOxx
    6243 |      13 |   1 |    3 |   3 |      3 |      43 |      243 |         243 |      1243 |     6243 |  86 |   87 | DGAAAA   | NAAAAA   | HHHHxx
(5 rows)

FETCH backward 6 in foo18;
 unique1 | unique2 | two | four | ten | twenty | hundred | thousand | twothousand | fivethous | tenthous | odd | even | stringu1 | stringu2 | string4 
---------+---------+-----+------+-----+--------+---------+----------+-------------+-----------+----------+-----+------+----------+----------+---------
    5387 |      16 |   1 |    3 |   7 |      7 |      87 |      387 |        1387 |       387 |     5387 | 174 |  175 | FZAAAA   | QAAAAA   | AAAAxx
    5006 |      15 |   0 |    2 |   6 |      6 |       6 |        6 |        1006 |         6 |     5006 |  12 |   13 | OKAAAA   | PAAAAA   | VVVVxx
    5471 |      14 |   1 |    3 |   1 |     11 |      71 |      471 |        1471 |       471 |     5471 | 142 |  143 | LCAAAA   | OAAAAA   | OOOOxx
    6243 |      13 |   1 |    3 |   3 |      3 |      43 |      243 |         243 |      1243 |     6243 |  86 |   87 | DGAAAA   | NAAAAA   | HHHHxx
    5222 |      12 |   0 |    2 |   2 |      2 |      22 |      222 |        1222 |       222 |     5222 |  44 |   45 | WSAAAA   | MAAAAA   | AAAAxx
    1504 |      11 |   0 |    0 |   4 |      4 |       4 |      504 |        1504 |      1504 |     1504 |   8 |    9 | WFAAAA   | LAAAAA   | VVVVxx
(6 rows)

FETCH backward 7 in foo17;
 unique1 | unique2 | two | four | ten | twenty | hundred | thousand | twothousand | fivethous | tenthous | odd | even | stringu1 | stringu2 | string4 
---------+---------+-----+------+-----+--------+---------+----------+-------------+-----------+----------+-----+------+----------+----------+---------
    5006 |      15 |   0 |    2 |   6 |      6 |       6 |        6 |        1006 |         6 |     5006 |  12 |   13 | OKAAAA   | PAAAAA   | VVVVxx
    5471 |      14 |   1 |    3 |   1 |     11 |      71 |      471 |        1471 |       471 |     5471 | 142 |  143 | LCAAAA   | OAAAAA   | OOOOxx
    6243 |      13 |   1 |    3 |   3 |      3 |      43 |      243 |         243 |      1243 |     6243 |  86 |   87 | DGAAAA   | NAAAAA   | HHHHxx
    5222 |      12 |   0 |    2 |   2 |      2 |      22 |      222 |        1222 |       222 |     5222 |  44 |   45 | WSAAAA   | MAAAAA   | AAAAxx
    1504 |      11 |   0 |    0 |   4 |      4 |       4 |      504 |        1504 |      1504 |     1504 |   8 |    9 | WFAAAA   | LAAAAA   | VVVVxx
    1314 |      10 |   0 |    2 |   4 |     14 |      14 |      314 |        1314 |      1314 |     1314 |  28 |   29 | OYAAAA   | KAAAAA   | OOOOxx
    3043 |       9 |   1 |    3 |   3 |      3 |      43 |       43 |        1043 |      3043 |     3043 |  86 |   87 | BNAAAA   | JAAAAA   | HHHHxx
(7 rows)

FETCH backward 8 in foo16;
 unique1 | unique2 | two | four | ten | twenty | hundred | thousand | twothousand | fivethous | tenthous | odd | even | stringu1 | stringu2 | string4 
---------+---------+-----+------+-----+--------+---------+----------+-------------+-----------+----------+-----+------+----------+----------+---------
    5471 |      14 |   1 |    3 |   1 |     11 |      71 |      471 |        1471 |       471 |     5471 | 142 |  143 | LCAAAA   | OAAAAA   | OOOOxx
    6243 |      13 |   1 |    3 |   3 |      3 |      43 |      243 |         243 |      1243 |     6243 |  86 |   87 | DGAAAA   | NAAAAA   | HHHHxx
    5222 |      12 |   0 |    2 |   2 |      2 |      22 |      222 |        1222 |       222 |     5222 |  44 |   45 | WSAAAA   | MAAAAA   | AAAAxx
    1504 |      11 |   0 |    0 |   4 |      4 |       4 |      504 |        1504 |      1504 |     1504 |   8 |    9 | WFAAAA   | LAAAAA   | VVVVxx
    1314 |      10 |   0 |    2 |   4 |     14 |      14 |      314 |        1314 |      1314 |     1314 |  28 |   29 | OYAAAA   | KAAAAA   | OOOOxx
    3043 |       9 |   1 |    3 |   3 |      3 |      43 |       43 |        1043 |      3043 |     3043 |  86 |   87 | BNAAAA   | JAAAAA   | HHHHxx
    4321 |       8 |   1 |    1 |   1 |      1 |      21 |      321 |         321 |      4321 |     4321 |  42 |   43 | FKAAAA   | IAAAAA   | AAAAxx
    6701 |       7 |   1 |    1 |   1 |      1 |       1 |      701 |         701 |      1701 |     6701 |   2 |    3 | TXAAAA   | HAAAAA   | VVVVxx
(8 rows)

FETCH backward 9 in foo15;
 unique1 | unique2 | two | four | ten | twenty | hundred | thousand | twothousand | fivethous | tenthous | odd | even | stringu1 | stringu2 | string4 
---------+---------+-----+------+-----+--------+---------+----------+-------------+-----------+----------+-----+------+----------+----------+---------
    6243 |      13 |   1 |    3 |   3 |      3 |      43 |      243 |         243 |      1243 |     6243 |  86 |   87 | DGAAAA   | NAAAAA   | HHHHxx
    5222 |      12 |   0 |    2 |   2 |      2 |      22 |      222 |        1222 |       222 |     5222 |  44 |   45 | WSAAAA   | MAAAAA   | AAAAxx
    1504 |      11 |   0 |    0 |   4 |      4 |       4 |      504 |        1504 |      1504 |     1504 |   8 |    9 | WFAAAA   | LAAAAA   | VVVVxx
    1314 |      10 |   0 |    2 |   4 |     14 |      14 |      314 |        1314 |      1314 |     1314 |  28 |   29 | OYAAAA   | KAAAAA   | OOOOxx
    3043 |       9 |   1 |    3 |   3 |      3 |      43 |       43 |        1043 |      3043 |     3043 |  86 |   87 | BNAAAA   | JAAAAA   | HHHHxx
    4321 |       8 |   1 |    1 |   1 |      1 |      21 |      321 |         321 |      4321 |     4321 |  42 |   43 | FKAAAA   | IAAAAA   | AAAAxx
    6701 |       7 |   1 |    1 |   1 |      1 |       1 |      701 |         701 |      1701 |     6701 |   2 |    3 | TXAAAA   | HAAAAA   | VVVVxx
    5057 |       6 |   1 |    1 |   7 |     17 |      57 |       57 |        1057 |        57 |     5057 | 114 |  115 | NMAAAA   | GAAAAA   | OOOOxx
    8009 |       5 |   1 |    1 |   9 |      9 |       9 |        9 |           9 |      3009 |     8009 |  18 |   19 | BWAAAA   | FAAAAA   | HHHHxx
(9 rows)

FETCH backward 10 in foo14;
 unique1 | unique2 | two | four | ten | twenty | hundred | thousand | twothousand | fivethous | tenthous | odd | even | stringu1 | stringu2 | string4 
---------+---------+-----+------+-----+--------+---------+----------+-------------+-----------+----------+-----+------+----------+----------+---------
    5222 |      12 |   0 |    2 |   2 |      2 |      22 |      222 |        1222 |       222 |     5222 |  44 |   45 | WSAAAA   | MAAAAA   | AAAAxx
    1504 |      11 |   0 |    0 |   4 |      4 |       4 |      504 |        1504 |      1504 |     1504 |   8 |    9 | WFAAAA   | LAAAAA   | VVVVxx
    1314 |      10 |   0 |    2 |   4 |     14 |      14 |      314 |        1314 |      1314 |     1314 |  28 |   29 | OYAAAA   | KAAAAA   | OOOOxx
    3043 |       9 |   1 |    3 |   3 |      3 |      43 |       43 |        1043 |      3043 |     3043 |  86 |   87 | BNAAAA   | JAAAAA   | HHHHxx
    4321 |       8 |   1 |    1 |   1 |      1 |      21 |      321 |         321 |      4321 |     4321 |  42 |   43 | FKAAAA   | IAAAAA   | AAAAxx
    6701 |       7 |   1 |    1 |   1 |      1 |       1 |      701 |         701 |      1701 |     6701 |   2 |    3 | TXAAAA   | HAAAAA   | VVVVxx
    5057 |       6 |   1 |    1 |   7 |     17 |      57 |       57 |        1057 |        57 |     5057 | 114 |  115 | NMAAAA   | GAAAAA   | OOOOxx
    8009 |       5 |   1 |    1 |   9 |      9 |       9 |        9 |           9 |      3009 |     8009 |  18 |   19 | BWAAAA   | FAAAAA   | HHHHxx
    7164 |       4 |   0 |    0 |   4 |      4 |      64 |      164 |        1164 |      2164 |     7164 | 128 |  129 | OPAAAA   | EAAAAA   | AAAAxx
    9850 |       3 |   0 |    2 |   0 |     10 |      50 |      850 |        1850 |      4850 |     9850 | 100 |  101 | WOAAAA   | DAAAAA   | VVVVxx
(10 rows)

FETCH backward 11 in foo13;
 unique1 | unique2 | two | four | ten | twenty | hundred | thousand | twothousand | fivethous | tenthous | odd | even | stringu1 | stringu2 | string4 
---------+---------+-----+------+-----+--------+---------+----------+-------------+-----------+----------+-----+------+----------+----------+---------
    1504 |      11 |   0 |    0 |   4 |      4 |       4 |      504 |        1504 |      1504 |     1504 |   8 |    9 | WFAAAA   | LAAAAA   | VVVVxx
    1314 |      10 |   0 |    2 |   4 |     14 |      14 |      314 |        1314 |      1314 |     1314 |  28 |   29 | OYAAAA   | KAAAAA   | OOOOxx
    3043 |       9 |   1 |    3 |   3 |      3 |      43 |       43 |        1043 |      3043 |     3043 |  86 |   87 | BNAAAA   | JAAAAA   | HHHHxx
    4321 |       8 |   1 |    1 |   1 |      1 |      21 |      321 |         321 |      4321 |     4321 |  42 |   43 | FKAAAA   | IAAAAA   | AAAAxx
    6701 |       7 |   1 |    1 |   1 |      1 |       1 |      701 |         701 |      1701 |     6701 |   2 |    3 | TXAAAA   | HAAAAA   | VVVVxx
    5057 |       6 |   1 |    1 |   7 |     17 |      57 |       57 |        1057 |        57 |     5057 | 114 |  115 | NMAAAA   | GAAAAA   | OOOOxx
    8009 |       5 |   1 |    1 |   9 |      9 |       9 |        9 |           9 |      3009 |     8009 |  18 |   19 | BWAAAA   | FAAAAA   | HHHHxx
    7164 |       4 |   0 |    0 |   4 |      4 |      64 |      164 |        1164 |      2164 |     7164 | 128 |  129 | OPAAAA   | EAAAAA   | AAAAxx
    9850 |       3 |   0 |    2 |   0 |     10 |      50 |      850 |        1850 |      4850 |     9850 | 100 |  101 | WOAAAA   | DAAAAA   | VVVVxx
    3420 |       2 |   0 |    0 |   0 |      0 |      20 |      420 |        1420 |      3420 |     3420 |  40 |   41 | OBAAAA   | CAAAAA   | OOOOxx
    1891 |       1 |   1 |    3 |   1 |     11 |      91 |      891 |        1891 |      1891 |     1891 | 182 |  183 | TUAAAA   | BAAAAA   | HHHHxx
(11 rows)

FETCH backward 12 in foo12;
 unique1 | unique2 | two | four | ten | twenty | hundred | thousand | twothousand | fivethous | tenthous | odd | even | stringu1 | stringu2 | string4 
---------+---------+-----+------+-----+--------+---------+----------+-------------+-----------+----------+-----+------+----------+----------+---------
    1314 |      10 |   0 |    2 |   4 |     14 |      14 |      314 |        1314 |      1314 |     1314 |  28 |   29 | OYAAAA   | KAAAAA   | OOOOxx
    3043 |       9 |   1 |    3 |   3 |      3 |      43 |       43 |        1043 |      3043 |     3043 |  86 |   87 | BNAAAA   | JAAAAA   | HHHHxx
    4321 |       8 |   1 |    1 |   1 |      1 |      21 |      321 |         321 |      4321 |     4321 |  42 |   43 | FKAAAA   | IAAAAA   | AAAAxx
    6701 |       7 |   1 |    1 |   1 |      1 |       1 |      701 |         701 |      1701 |     6701 |   2 |    3 | TXAAAA   | HAAAAA   | VVVVxx
    5057 |       6 |   1 |    1 |   7 |     17 |      57 |       57 |        1057 |        57 |     5057 | 114 |  115 | NMAAAA   | GAAAAA   | OOOOxx
    8009 |       5 |   1 |    1 |   9 |      9 |       9 |        9 |           9 |      3009 |     8009 |  18 |   19 | BWAAAA   | FAAAAA   | HHHHxx
    7164 |       4 |   0 |    0 |   4 |      4 |      64 |      164 |        1164 |      2164 |     7164 | 128 |  129 | OPAAAA   | EAAAAA   | AAAAxx
    9850 |       3 |   0 |    2 |   0 |     10 |      50 |      850 |        1850 |      4850 |     9850 | 100 |  101 | WOAAAA   | DAAAAA   | VVVVxx
    3420 |       2 |   0 |    0 |   0 |      0 |      20 |      420 |        1420 |      3420 |     3420 |  40 |   41 | OBAAAA   | CAAAAA   | OOOOxx
    1891 |       1 |   1 |    3 |   1 |     11 |      91 |      891 |        1891 |      1891 |     1891 | 182 |  183 | TUAAAA   | BAAAAA   | HHHHxx
    8800 |       0 |   0 |    0 |   0 |      0 |       0 |      800 |         800 |      3800 |     8800 |   0 |    1 | MAAAAA   | AAAAAA   | AAAAxx
(11 rows)

FETCH backward 13 in foo11;
 unique1 | unique2 | two | four | ten | twenty | hundred | thousand | twothousand | fivethous | tenthous | odd | even | stringu1 | stringu2 | string4 
---------+---------+-----+------+-----+--------+---------+----------+-------------+-----------+----------+-----+------+----------+----------+---------
    3043 |       9 |   1 |    3 |   3 |      3 |      43 |       43 |        1043 |      3043 |     3043 |  86 |   87 | BNAAAA   | JAAAAA   | HHHHxx
    4321 |       8 |   1 |    1 |   1 |      1 |      21 |      321 |         321 |      4321 |     4321 |  42 |   43 | FKAAAA   | IAAAAA   | AAAAxx
    6701 |       7 |   1 |    1 |   1 |      1 |       1 |      701 |         701 |      1701 |     6701 |   2 |    3 | TXAAAA   | HAAAAA   | VVVVxx
    5057 |       6 |   1 |    1 |   7 |     17 |      57 |       57 |        1057 |        57 |     5057 | 114 |  115 | NMAAAA   | GAAAAA   | OOOOxx
    8009 |       5 |   1 |    1 |   9 |      9 |       9 |        9 |           9 |      3009 |     8009 |  18 |   19 | BWAAAA   | FAAAAA   | HHHHxx
    7164 |       4 |   0 |    0 |   4 |      4 |      64 |      164 |        1164 |      2164 |     7164 | 128 |  129 | OPAAAA   | EAAAAA   | AAAAxx
    9850 |       3 |   0 |    2 |   0 |     10 |      50 |      850 |        1850 |      4850 |     9850 | 100 |  101 | WOAAAA   | DAAAAA   | VVVVxx
    3420 |       2 |   0 |    0 |   0 |      0 |      20 |      420 |        1420 |      3420 |     3420 |  40 |   41 | OBAAAA   | CAAAAA   | OOOOxx
    1891 |       1 |   1 |    3 |   1 |     11 |      91 |      891 |        1891 |      1891 |     1891 | 182 |  183 | TUAAAA   | BAAAAA   | HHHHxx
    8800 |       0 |   0 |    0 |   0 |      0 |       0 |      800 |         800 |      3800 |     8800 |   0 |    1 | MAAAAA   | AAAAAA   | AAAAxx
(10 rows)

FETCH backward 14 in foo10;
 unique1 | unique2 | two | four | ten | twenty | hundred | thousand | twothousand | fivethous | tenthous | odd | even | stringu1 | stringu2 | string4 
---------+---------+-----+------+-----+--------+---------+----------+-------------+-----------+----------+-----+------+----------+----------+---------
    4321 |       8 |   1 |    1 |   1 |      1 |      21 |      321 |         321 |      4321 |     4321 |  42 |   43 | FKAAAA   | IAAAAA   | AAAAxx
    6701 |       7 |   1 |    1 |   1 |      1 |       1 |      701 |         701 |      1701 |     6701 |   2 |    3 | TXAAAA   | HAAAAA   | VVVVxx
    5057 |       6 |   1 |    1 |   7 |     17 |      57 |       57 |        1057 |        57 |     5057 | 114 |  115 | NMAAAA   | GAAAAA   | OOOOxx
    8009 |       5 |   1 |    1 |   9 |      9 |       9 |        9 |           9 |      3009 |     8009 |  18 |   19 | BWAAAA   | FAAAAA   | HHHHxx
    7164 |       4 |   0 |    0 |   4 |      4 |      64 |      164 |        1164 |      2164 |     7164 | 128 |  129 | OPAAAA   | EAAAAA   | AAAAxx
    9850 |       3 |   0 |    2 |   0 |     10 |      50 |      850 |        1850 |      4850 |     9850 | 100 |  101 | WOAAAA   | DAAAAA   | VVVVxx
    3420 |       2 |   0 |    0 |   0 |      0 |      20 |      420 |        1420 |      3420 |     3420 |  40 |   41 | OBAAAA   | CAAAAA   | OOOOxx
    1891 |       1 |   1 |    3 |   1 |     11 |      91 |      891 |        1891 |      1891 |     1891 | 182 |  183 | TUAAAA   | BAAAAA   | HHHHxx
    8800 |       0 |   0 |    0 |   0 |      0 |       0 |      800 |         800 |      3800 |     8800 |   0 |    1 | MAAAAA   | AAAAAA   | AAAAxx
(9 rows)

FETCH backward 15 in foo9;
 unique1 | unique2 | two | four | ten | twenty | hundred | thousand | twothousand | fivethous | tenthous | odd | even | stringu1 | stringu2 | string4 
---------+---------+-----+------+-----+--------+---------+----------+-------------+-----------+----------+-----+------+----------+----------+---------
    6701 |       7 |   1 |    1 |   1 |      1 |       1 |      701 |         701 |      1701 |     6701 |   2 |    3 | TXAAAA   | HAAAAA   | VVVVxx
    5057 |       6 |   1 |    1 |   7 |     17 |      57 |       57 |        1057 |        57 |     5057 | 114 |  115 | NMAAAA   | GAAAAA   | OOOOxx
    8009 |       5 |   1 |    1 |   9 |      9 |       9 |        9 |           9 |      3009 |     8009 |  18 |   19 | BWAAAA   | FAAAAA   | HHHHxx
    7164 |       4 |   0 |    0 |   4 |      4 |      64 |      164 |        1164 |      2164 |     7164 | 128 |  129 | OPAAAA   | EAAAAA   | AAAAxx
    9850 |       3 |   0 |    2 |   0 |     10 |      50 |      850 |        1850 |      4850 |     9850 | 100 |  101 | WOAAAA   | DAAAAA   | VVVVxx
    3420 |       2 |   0 |    0 |   0 |      0 |      20 |      420 |        1420 |      3420 |     3420 |  40 |   41 | OBAAAA   | CAAAAA   | OOOOxx
    1891 |       1 |   1 |    3 |   1 |     11 |      91 |      891 |        1891 |      1891 |     1891 | 182 |  183 | TUAAAA   | BAAAAA   | HHHHxx
    8800 |       0 |   0 |    0 |   0 |      0 |       0 |      800 |         800 |      3800 |     8800 |   0 |    1 | MAAAAA   | AAAAAA   | AAAAxx
(8 rows)

FETCH backward 16 in foo8;
 unique1 | unique2 | two | four | ten | twenty | hundred | thousand | twothousand | fivethous | tenthous | odd | even | stringu1 | stringu2 | string4 
---------+---------+-----+------+-----+--------+---------+----------+-------------+-----------+----------+-----+------+----------+----------+---------
    5057 |       6 |   1 |    1 |   7 |     17 |      57 |       57 |        1057 |        57 |     5057 | 114 |  115 | NMAAAA   | GAAAAA   | OOOOxx
    8009 |       5 |   1 |    1 |   9 |      9 |       9 |        9 |           9 |      3009 |     8009 |  18 |   19 | BWAAAA   | FAAAAA   | HHHHxx
    7164 |       4 |   0 |    0 |   4 |      4 |      64 |      164 |        1164 |      2164 |     7164 | 128 |  129 | OPAAAA   | EAAAAA   | AAAAxx
    9850 |       3 |   0 |    2 |   0 |     10 |      50 |      850 |        1850 |      4850 |     9850 | 100 |  101 | WOAAAA   | DAAAAA   | VVVVxx
    3420 |       2 |   0 |    0 |   0 |      0 |      20 |      420 |        1420 |      3420 |     3420 |  40 |   41 | OBAAAA   | CAAAAA   | OOOOxx
    1891 |       1 |   1 |    3 |   1 |     11 |      91 |      891 |        1891 |      1891 |     1891 | 182 |  183 | TUAAAA   | BAAAAA   | HHHHxx
    8800 |       0 |   0 |    0 |   0 |      0 |       0 |      800 |         800 |      3800 |     8800 |   0 |    1 | MAAAAA   | AAAAAA   | AAAAxx
(7 rows)

FETCH backward 17 in foo7;
 unique1 | unique2 | two | four | ten | twenty | hundred | thousand | twothousand | fivethous | tenthous | odd | even | stringu1 | stringu2 | string4 
---------+---------+-----+------+-----+--------+---------+----------+-------------+-----------+----------+-----+------+----------+----------+---------
    8009 |       5 |   1 |    1 |   9 |      9 |       9 |        9 |           9 |      3009 |     8009 |  18 |   19 | BWAAAA   | FAAAAA   | HHHHxx
    7164 |       4 |   0 |    0 |   4 |      4 |      64 |      164 |        1164 |      2164 |     7164 | 128 |  129 | OPAAAA   | EAAAAA   | AAAAxx
    9850 |       3 |   0 |    2 |   0 |     10 |      50 |      850 |        1850 |      4850 |     9850 | 100 |  101 | WOAAAA   | DAAAAA   | VVVVxx
    3420 |       2 |   0 |    0 |   0 |      0 |      20 |      420 |        1420 |      3420 |     3420 |  40 |   41 | OBAAAA   | CAAAAA   | OOOOxx
    1891 |       1 |   1 |    3 |   1 |     11 |      91 |      891 |        1891 |      1891 |     1891 | 182 |  183 | TUAAAA   | BAAAAA   | HHHHxx
    8800 |       0 |   0 |    0 |   0 |      0 |       0 |      800 |         800 |      3800 |     8800 |   0 |    1 | MAAAAA   | AAAAAA   | AAAAxx
(6 rows)

FETCH backward 18 in foo6;
 unique1 | unique2 | two | four | ten | twenty | hundred | thousand | twothousand | fivethous | tenthous | odd | even | stringu1 | stringu2 | string4 
---------+---------+-----+------+-----+--------+---------+----------+-------------+-----------+----------+-----+------+----------+----------+---------
    7164 |       4 |   0 |    0 |   4 |      4 |      64 |      164 |        1164 |      2164 |     7164 | 128 |  129 | OPAAAA   | EAAAAA   | AAAAxx
    9850 |       3 |   0 |    2 |   0 |     10 |      50 |      850 |        1850 |      4850 |     9850 | 100 |  101 | WOAAAA   | DAAAAA   | VVVVxx
    3420 |       2 |   0 |    0 |   0 |      0 |      20 |      420 |        1420 |      3420 |     3420 |  40 |   41 | OBAAAA   | CAAAAA   | OOOOxx
    1891 |       1 |   1 |    3 |   1 |     11 |      91 |      891 |        1891 |      1891 |     1891 | 182 |  183 | TUAAAA   | BAAAAA   | HHHHxx
    8800 |       0 |   0 |    0 |   0 |      0 |       0 |      800 |         800 |      3800 |     8800 |   0 |    1 | MAAAAA   | AAAAAA   | AAAAxx
(5 rows)

FETCH backward 19 in foo5;
 unique1 | unique2 | two | four | ten | twenty | hundred | thousand | twothousand | fivethous | tenthous | odd | even | stringu1 | stringu2 | string4 
---------+---------+-----+------+-----+--------+---------+----------+-------------+-----------+----------+-----+------+----------+----------+---------
    9850 |       3 |   0 |    2 |   0 |     10 |      50 |      850 |        1850 |      4850 |     9850 | 100 |  101 | WOAAAA   | DAAAAA   | VVVVxx
    3420 |       2 |   0 |    0 |   0 |      0 |      20 |      420 |        1420 |      3420 |     3420 |  40 |   41 | OBAAAA   | CAAAAA   | OOOOxx
    1891 |       1 |   1 |    3 |   1 |     11 |      91 |      891 |        1891 |      1891 |     1891 | 182 |  183 | TUAAAA   | BAAAAA   | HHHHxx
    8800 |       0 |   0 |    0 |   0 |      0 |       0 |      800 |         800 |      3800 |     8800 |   0 |    1 | MAAAAA   | AAAAAA   | AAAAxx
(4 rows)

FETCH backward 20 in foo4;
 unique1 | unique2 | two | four | ten | twenty | hundred | thousand | twothousand | fivethous | tenthous | odd | even | stringu1 | stringu2 | string4 
---------+---------+-----+------+-----+--------+---------+----------+-------------+-----------+----------+-----+------+----------+----------+---------
    3420 |       2 |   0 |    0 |   0 |      0 |      20 |      420 |        1420 |      3420 |     3420 |  40 |   41 | OBAAAA   | CAAAAA   | OOOOxx
    1891 |       1 |   1 |    3 |   1 |     11 |      91 |      891 |        1891 |      1891 |     1891 | 182 |  183 | TUAAAA   | BAAAAA   | HHHHxx
    8800 |       0 |   0 |    0 |   0 |      0 |       0 |      800 |         800 |      3800 |     8800 |   0 |    1 | MAAAAA   | AAAAAA   | AAAAxx
(3 rows)

FETCH backward 21 in foo3;
 unique1 | unique2 | two | four | ten | twenty | hundred | thousand | twothousand | fivethous | tenthous | odd | even | stringu1 | stringu2 | string4 
---------+---------+-----+------+-----+--------+---------+----------+-------------+-----------+----------+-----+------+----------+----------+---------
    1891 |       1 |   1 |    3 |   1 |     11 |      91 |      891 |        1891 |      1891 |     1891 | 182 |  183 | TUAAAA   | BAAAAA   | HHHHxx
    8800 |       0 |   0 |    0 |   0 |      0 |       0 |      800 |         800 |      3800 |     8800 |   0 |    1 | MAAAAA   | AAAAAA   | AAAAxx
(2 rows)

FETCH backward 22 in foo2;
 unique1 | unique2 | two | four | ten | twenty | hundred | thousand | twothousand | fivethous | tenthous | odd | even | stringu1 | stringu2 | string4 
---------+---------+-----+------+-----+--------+---------+----------+-------------+-----------+----------+-----+------+----------+----------+---------
    8800 |       0 |   0 |    0 |   0 |      0 |       0 |      800 |         800 |      3800 |     8800 |   0 |    1 | MAAAAA   | AAAAAA   | AAAAxx
(1 row)

FETCH backward 23 in foo1;
 unique1 | unique2 | two | four | ten | twenty | hundred | thousand | twothousand | fivethous | tenthous | odd | even | stringu1 | stringu2 | string4 
---------+---------+-----+------+-----+--------+---------+----------+-------------+-----------+----------+-----+------+----------+----------+---------
(0 rows)

CLOSE foo1;
CLOSE foo2;
CLOSE foo3;
CLOSE foo4;
CLOSE foo5;
CLOSE foo6;
CLOSE foo7;
CLOSE foo8;
CLOSE foo9;
CLOSE foo10;
CLOSE foo11;
CLOSE foo12;
-- leave some cursors open, to test that auto-close works.
-- record this in the system view as well (don't query the time field there
-- however)
SELECT name, statement, is_holdable, is_binary, is_scrollable FROM pg_cursors ORDER BY 1;
 name  |                               statement                               | is_holdable | is_binary | is_scrollable 
-------+-----------------------------------------------------------------------+-------------+-----------+---------------
 foo13 | DECLARE foo13 SCROLL CURSOR FOR SELECT * FROM tenk1 ORDER BY unique2; | f           | f         | t
 foo14 | DECLARE foo14 SCROLL CURSOR FOR SELECT * FROM tenk2;                  | f           | f         | t
 foo15 | DECLARE foo15 SCROLL CURSOR FOR SELECT * FROM tenk1 ORDER BY unique2; | f           | f         | t
 foo16 | DECLARE foo16 SCROLL CURSOR FOR SELECT * FROM tenk2;                  | f           | f         | t
 foo17 | DECLARE foo17 SCROLL CURSOR FOR SELECT * FROM tenk1 ORDER BY unique2; | f           | f         | t
 foo18 | DECLARE foo18 SCROLL CURSOR FOR SELECT * FROM tenk2;                  | f           | f         | t
 foo19 | DECLARE foo19 SCROLL CURSOR FOR SELECT * FROM tenk1 ORDER BY unique2; | f           | f         | t
 foo20 | DECLARE foo20 SCROLL CURSOR FOR SELECT * FROM tenk2;                  | f           | f         | t
 foo21 | DECLARE foo21 SCROLL CURSOR FOR SELECT * FROM tenk1 ORDER BY unique2; | f           | f         | t
 foo22 | DECLARE foo22 SCROLL CURSOR FOR SELECT * FROM tenk2;                  | f           | f         | t
 foo23 | DECLARE foo23 SCROLL CURSOR FOR SELECT * FROM tenk1 ORDER BY unique2; | f           | f         | t
(11 rows)

END;
SELECT name, statement, is_holdable, is_binary, is_scrollable FROM pg_cursors;
 name | statement | is_holdable | is_binary | is_scrollable 
------+-----------+-------------+-----------+---------------
(0 rows)

--
-- NO SCROLL disallows backward fetching
--
BEGIN;
DECLARE foo24 NO SCROLL CURSOR FOR SELECT * FROM tenk1 ORDER BY unique2;
FETCH 1 FROM foo24;
 unique1 | unique2 | two | four | ten | twenty | hundred | thousand | twothousand | fivethous | tenthous | odd | even | stringu1 | stringu2 | string4 
---------+---------+-----+------+-----+--------+---------+----------+-------------+-----------+----------+-----+------+----------+----------+---------
    8800 |       0 |   0 |    0 |   0 |      0 |       0 |      800 |         800 |      3800 |     8800 |   0 |    1 | MAAAAA   | AAAAAA   | AAAAxx
(1 row)

FETCH BACKWARD 1 FROM foo24; -- should fail
ERROR:  cursor can only scan forward
HINT:  Declare it with SCROLL option to enable backward scan.
END;
--
-- Cursors outside transaction blocks
--
SELECT name, statement, is_holdable, is_binary, is_scrollable FROM pg_cursors;
 name | statement | is_holdable | is_binary | is_scrollable 
------+-----------+-------------+-----------+---------------
(0 rows)

BEGIN;
DECLARE foo25 SCROLL CURSOR WITH HOLD FOR SELECT * FROM tenk2;
FETCH FROM foo25;
 unique1 | unique2 | two | four | ten | twenty | hundred | thousand | twothousand | fivethous | tenthous | odd | even | stringu1 | stringu2 | string4 
---------+---------+-----+------+-----+--------+---------+----------+-------------+-----------+----------+-----+------+----------+----------+---------
    8800 |       0 |   0 |    0 |   0 |      0 |       0 |      800 |         800 |      3800 |     8800 |   0 |    1 | MAAAAA   | AAAAAA   | AAAAxx
(1 row)

FETCH FROM foo25;
 unique1 | unique2 | two | four | ten | twenty | hundred | thousand | twothousand | fivethous | tenthous | odd | even | stringu1 | stringu2 | string4 
---------+---------+-----+------+-----+--------+---------+----------+-------------+-----------+----------+-----+------+----------+----------+---------
    1891 |       1 |   1 |    3 |   1 |     11 |      91 |      891 |        1891 |      1891 |     1891 | 182 |  183 | TUAAAA   | BAAAAA   | HHHHxx
(1 row)

COMMIT;
FETCH FROM foo25;
 unique1 | unique2 | two | four | ten | twenty | hundred | thousand | twothousand | fivethous | tenthous | odd | even | stringu1 | stringu2 | string4 
---------+---------+-----+------+-----+--------+---------+----------+-------------+-----------+----------+-----+------+----------+----------+---------
    3420 |       2 |   0 |    0 |   0 |      0 |      20 |      420 |        1420 |      3420 |     3420 |  40 |   41 | OBAAAA   | CAAAAA   | OOOOxx
(1 row)

FETCH BACKWARD FROM foo25;
 unique1 | unique2 | two | four | ten | twenty | hundred | thousand | twothousand | fivethous | tenthous | odd | even | stringu1 | stringu2 | string4 
---------+---------+-----+------+-----+--------+---------+----------+-------------+-----------+----------+-----+------+----------+----------+---------
    1891 |       1 |   1 |    3 |   1 |     11 |      91 |      891 |        1891 |      1891 |     1891 | 182 |  183 | TUAAAA   | BAAAAA   | HHHHxx
(1 row)

FETCH ABSOLUTE -1 FROM foo25;
 unique1 | unique2 | two | four | ten | twenty | hundred | thousand | twothousand | fivethous | tenthous | odd | even | stringu1 | stringu2 | string4 
---------+---------+-----+------+-----+--------+---------+----------+-------------+-----------+----------+-----+------+----------+----------+---------
    2968 |    9999 |   0 |    0 |   8 |      8 |      68 |      968 |         968 |      2968 |     2968 | 136 |  137 | EKAAAA   | PUOAAA   | VVVVxx
(1 row)

SELECT name, statement, is_holdable, is_binary, is_scrollable FROM pg_cursors;
 name  |                           statement                            | is_holdable | is_binary | is_scrollable 
-------+----------------------------------------------------------------+-------------+-----------+---------------
 foo25 | DECLARE foo25 SCROLL CURSOR WITH HOLD FOR SELECT * FROM tenk2; | t           | f         | t
(1 row)

CLOSE foo25;
--
-- ROLLBACK should close holdable cursors
--
BEGIN;
DECLARE foo26 CURSOR WITH HOLD FOR SELECT * FROM tenk1 ORDER BY unique2;
ROLLBACK;
-- should fail
FETCH FROM foo26;
ERROR:  cursor "foo26" does not exist
--
-- Parameterized DECLARE needs to insert param values into the cursor portal
--
BEGIN;
CREATE FUNCTION declares_cursor(text)
   RETURNS void
   AS 'DECLARE c CURSOR FOR SELECT stringu1 FROM tenk1 WHERE stringu1 LIKE $1;'
   LANGUAGE SQL;
SELECT declares_cursor('AB%');
 declares_cursor 
-----------------
 
(1 row)

FETCH ALL FROM c;
 stringu1 
----------
 ABAAAA
 ABAAAA
 ABAAAA
 ABAAAA
 ABAAAA
 ABAAAA
 ABAAAA
 ABAAAA
 ABAAAA
 ABAAAA
 ABAAAA
 ABAAAA
 ABAAAA
 ABAAAA
 ABAAAA
(15 rows)

ROLLBACK;
--
-- Test behavior of both volatile and stable functions inside a cursor;
-- in particular we want to see what happens during commit of a holdable
-- cursor
--
create temp table tt1(f1 int);
create function count_tt1_v() returns int8 as
'select count(*) from tt1' language sql volatile;
create function count_tt1_s() returns int8 as
'select count(*) from tt1' language sql stable;
begin;
insert into tt1 values(1);
declare c1 cursor for select count_tt1_v(), count_tt1_s();
insert into tt1 values(2);
fetch all from c1;
 count_tt1_v | count_tt1_s 
-------------+-------------
           2 |           1
(1 row)

rollback;
begin;
insert into tt1 values(1);
declare c2 cursor with hold for select count_tt1_v(), count_tt1_s();
insert into tt1 values(2);
commit;
delete from tt1;
fetch all from c2;
 count_tt1_v | count_tt1_s 
-------------+-------------
           2 |           1
(1 row)

drop function count_tt1_v();
drop function count_tt1_s();
-- Create a cursor with the BINARY option and check the pg_cursors view
BEGIN;
SELECT name, statement, is_holdable, is_binary, is_scrollable FROM pg_cursors;
 name |                              statement                               | is_holdable | is_binary | is_scrollable 
------+----------------------------------------------------------------------+-------------+-----------+---------------
 c2   | declare c2 cursor with hold for select count_tt1_v(), count_tt1_s(); | t           | f         | f
(1 row)

DECLARE bc BINARY CURSOR FOR SELECT * FROM tenk1;
SELECT name, statement, is_holdable, is_binary, is_scrollable FROM pg_cursors ORDER BY 1;
 name |                              statement                               | is_holdable | is_binary | is_scrollable 
------+----------------------------------------------------------------------+-------------+-----------+---------------
 bc   | DECLARE bc BINARY CURSOR FOR SELECT * FROM tenk1;                    | f           | t         | t
 c2   | declare c2 cursor with hold for select count_tt1_v(), count_tt1_s(); | t           | f         | f
(2 rows)

ROLLBACK;
-- We should not see the portal that is created internally to
-- implement EXECUTE in pg_cursors
PREPARE cprep AS
  SELECT name, statement, is_holdable, is_binary, is_scrollable FROM pg_cursors;
EXECUTE cprep;
 name |                              statement                               | is_holdable | is_binary | is_scrollable 
------+----------------------------------------------------------------------+-------------+-----------+---------------
 c2   | declare c2 cursor with hold for select count_tt1_v(), count_tt1_s(); | t           | f         | f
(1 row)

-- test CLOSE ALL;
SELECT name FROM pg_cursors ORDER BY 1;
 name 
------
 c2
(1 row)

CLOSE ALL;
SELECT name FROM pg_cursors ORDER BY 1;
 name 
------
(0 rows)

BEGIN;
DECLARE foo1 CURSOR WITH HOLD FOR SELECT 1;
DECLARE foo2 CURSOR WITHOUT HOLD FOR SELECT 1;
SELECT name FROM pg_cursors ORDER BY 1;
 name 
------
 foo1
 foo2
(2 rows)

CLOSE ALL;
SELECT name FROM pg_cursors ORDER BY 1;
 name 
------
(0 rows)

COMMIT;
--
-- Tests for updatable cursors
--
CREATE TEMP TABLE uctest(f1 int, f2 text);
INSERT INTO uctest VALUES (1, 'one'), (2, 'two'), (3, 'three');
SELECT * FROM uctest;
 f1 |  f2   
----+-------
  1 | one
  2 | two
  3 | three
(3 rows)

-- Check DELETE WHERE CURRENT
BEGIN;
DECLARE c1 CURSOR FOR SELECT * FROM uctest;
FETCH 2 FROM c1;
 f1 | f2  
----+-----
  1 | one
  2 | two
(2 rows)

DELETE FROM uctest WHERE CURRENT OF c1;
-- should show deletion
SELECT * FROM uctest;
 f1 |  f2   
----+-------
  1 | one
  3 | three
(2 rows)

-- cursor did not move
FETCH ALL FROM c1;
 f1 |  f2   
----+-------
  3 | three
(1 row)

-- cursor is insensitive
MOVE BACKWARD ALL IN c1;
FETCH ALL FROM c1;
 f1 |  f2   
----+-------
  1 | one
  2 | two
  3 | three
(3 rows)

COMMIT;
-- should still see deletion
SELECT * FROM uctest;
 f1 |  f2   
----+-------
  1 | one
  3 | three
(2 rows)

-- Check UPDATE WHERE CURRENT; this time use FOR UPDATE
BEGIN;
DECLARE c1 CURSOR FOR SELECT * FROM uctest FOR UPDATE;
FETCH c1;
 f1 | f2  
----+-----
  1 | one
(1 row)

UPDATE uctest SET f1 = 8 WHERE CURRENT OF c1;
SELECT * FROM uctest;
 f1 |  f2   
----+-------
  3 | three
  8 | one
(2 rows)

COMMIT;
SELECT * FROM uctest;
 f1 |  f2   
----+-------
  3 | three
  8 | one
(2 rows)

-- Check repeated-update and update-then-delete cases
BEGIN;
DECLARE c1 CURSOR FOR SELECT * FROM uctest;
FETCH c1;
 f1 |  f2   
----+-------
  3 | three
(1 row)

UPDATE uctest SET f1 = f1 + 10 WHERE CURRENT OF c1;
SELECT * FROM uctest;
 f1 |  f2   
----+-------
  8 | one
 13 | three
(2 rows)

UPDATE uctest SET f1 = f1 + 10 WHERE CURRENT OF c1;
SELECT * FROM uctest;
 f1 |  f2   
----+-------
  8 | one
 23 | three
(2 rows)

-- insensitive cursor should not show effects of updates or deletes
FETCH RELATIVE 0 FROM c1;
 f1 |  f2   
----+-------
  3 | three
(1 row)

DELETE FROM uctest WHERE CURRENT OF c1;
SELECT * FROM uctest;
 f1 | f2  
----+-----
  8 | one
(1 row)

DELETE FROM uctest WHERE CURRENT OF c1; -- no-op
SELECT * FROM uctest;
 f1 | f2  
----+-----
  8 | one
(1 row)

UPDATE uctest SET f1 = f1 + 10 WHERE CURRENT OF c1; -- no-op
SELECT * FROM uctest;
 f1 | f2  
----+-----
  8 | one
(1 row)

FETCH RELATIVE 0 FROM c1;
 f1 |  f2   
----+-------
  3 | three
(1 row)

ROLLBACK;
SELECT * FROM uctest;
 f1 |  f2   
----+-------
  3 | three
  8 | one
(2 rows)

BEGIN;
DECLARE c1 CURSOR FOR SELECT * FROM uctest FOR UPDATE;
FETCH c1;
 f1 |  f2   
----+-------
  3 | three
(1 row)

UPDATE uctest SET f1 = f1 + 10 WHERE CURRENT OF c1;
SELECT * FROM uctest;
 f1 |  f2   
----+-------
  8 | one
 13 | three
(2 rows)

UPDATE uctest SET f1 = f1 + 10 WHERE CURRENT OF c1;
SELECT * FROM uctest;
 f1 |  f2   
----+-------
  8 | one
 23 | three
(2 rows)

DELETE FROM uctest WHERE CURRENT OF c1;
SELECT * FROM uctest;
 f1 | f2  
----+-----
  8 | one
(1 row)

DELETE FROM uctest WHERE CURRENT OF c1; -- no-op
SELECT * FROM uctest;
 f1 | f2  
----+-----
  8 | one
(1 row)

UPDATE uctest SET f1 = f1 + 10 WHERE CURRENT OF c1; -- no-op
SELECT * FROM uctest;
 f1 | f2  
----+-----
  8 | one
(1 row)

--- sensitive cursors can't currently scroll back, so this is an error:
FETCH RELATIVE 0 FROM c1;
ERROR:  cursor can only scan forward
HINT:  Declare it with SCROLL option to enable backward scan.
ROLLBACK;
SELECT * FROM uctest;
 f1 |  f2   
----+-------
  3 | three
  8 | one
(2 rows)

-- Check inheritance cases
CREATE TEMP TABLE ucchild () inherits (uctest);
INSERT INTO ucchild values(100, 'hundred');
SELECT * FROM uctest;
 f1  |   f2    
-----+---------
   3 | three
   8 | one
 100 | hundred
(3 rows)

BEGIN;
DECLARE c1 CURSOR FOR SELECT * FROM uctest FOR UPDATE;
FETCH 1 FROM c1;
 f1 |  f2   
----+-------
  3 | three
(1 row)

UPDATE uctest SET f1 = f1 + 10 WHERE CURRENT OF c1;
FETCH 1 FROM c1;
 f1 | f2  
----+-----
  8 | one
(1 row)

UPDATE uctest SET f1 = f1 + 10 WHERE CURRENT OF c1;
FETCH 1 FROM c1;
 f1  |   f2    
-----+---------
 100 | hundred
(1 row)

UPDATE uctest SET f1 = f1 + 10 WHERE CURRENT OF c1;
FETCH 1 FROM c1;
 f1 | f2 
----+----
(0 rows)

COMMIT;
SELECT * FROM uctest;
 f1  |   f2    
-----+---------
  13 | three
  18 | one
 110 | hundred
(3 rows)

-- Can update from a self-join, but only if FOR UPDATE says which to use
BEGIN;
DECLARE c1 CURSOR FOR SELECT * FROM uctest a, uctest b WHERE a.f1 = b.f1 + 5;
FETCH 1 FROM c1;
 f1 | f2  | f1 |  f2   
----+-----+----+-------
 18 | one | 13 | three
(1 row)

UPDATE uctest SET f1 = f1 + 10 WHERE CURRENT OF c1;  -- fail
ERROR:  cursor "c1" is not a simply updatable scan of table "uctest"
ROLLBACK;
BEGIN;
DECLARE c1 CURSOR FOR SELECT * FROM uctest a, uctest b WHERE a.f1 = b.f1 + 5 FOR UPDATE;
FETCH 1 FROM c1;
 f1 | f2  | f1 |  f2   
----+-----+----+-------
 18 | one | 13 | three
(1 row)

UPDATE uctest SET f1 = f1 + 10 WHERE CURRENT OF c1;  -- fail
ERROR:  cursor "c1" has multiple FOR UPDATE/SHARE references to table "uctest"
ROLLBACK;
BEGIN;
DECLARE c1 CURSOR FOR SELECT * FROM uctest a, uctest b WHERE a.f1 = b.f1 + 5 FOR SHARE OF a;
FETCH 1 FROM c1;
 f1 | f2  | f1 |  f2   
----+-----+----+-------
 18 | one | 13 | three
(1 row)

UPDATE uctest SET f1 = f1 + 10 WHERE CURRENT OF c1;
SELECT * FROM uctest;
 f1  |   f2    
-----+---------
  13 | three
  28 | one
 110 | hundred
(3 rows)

ROLLBACK;
-- Check various error cases
DELETE FROM uctest WHERE CURRENT OF c1;  -- fail, no such cursor
ERROR:  cursor "c1" does not exist
DECLARE cx CURSOR WITH HOLD FOR SELECT * FROM uctest;
DELETE FROM uctest WHERE CURRENT OF cx;  -- fail, can't use held cursor
ERROR:  cursor "cx" is held from a previous transaction
BEGIN;
DECLARE c CURSOR FOR SELECT * FROM tenk2;
DELETE FROM uctest WHERE CURRENT OF c;  -- fail, cursor on wrong table
ERROR:  cursor "c" is not a simply updatable scan of table "uctest"
ROLLBACK;
BEGIN;
DECLARE c CURSOR FOR SELECT * FROM tenk2 FOR SHARE;
DELETE FROM uctest WHERE CURRENT OF c;  -- fail, cursor on wrong table
ERROR:  cursor "c" does not have a FOR UPDATE/SHARE reference to table "uctest"
ROLLBACK;
BEGIN;
DECLARE c CURSOR FOR SELECT * FROM tenk1 JOIN tenk2 USING (unique1);
DELETE FROM tenk1 WHERE CURRENT OF c;  -- fail, cursor is on a join
ERROR:  cursor "c" is not a simply updatable scan of table "tenk1"
ROLLBACK;
BEGIN;
DECLARE c CURSOR FOR SELECT f1,count(*) FROM uctest GROUP BY f1;
DELETE FROM uctest WHERE CURRENT OF c;  -- fail, cursor is on aggregation
ERROR:  cursor "c" is not a simply updatable scan of table "uctest"
ROLLBACK;
BEGIN;
DECLARE c1 CURSOR FOR SELECT * FROM uctest;
DELETE FROM uctest WHERE CURRENT OF c1; -- fail, no current row
ERROR:  cursor "c1" is not positioned on a row
ROLLBACK;
-- WHERE CURRENT OF may someday work with views, but today is not that day.
-- For now, just make sure it errors out cleanly.
CREATE TEMP VIEW ucview AS SELECT * FROM uctest;
NOTICE:  CREATE VIEW has created automatic view update rules
CREATE RULE ucrule AS ON DELETE TO ucview DO INSTEAD
  DELETE FROM uctest WHERE f1 = OLD.f1;
BEGIN;
DECLARE c1 CURSOR FOR SELECT * FROM ucview;
FETCH FROM c1;
 f1 |  f2   
----+-------
 13 | three
(1 row)

DELETE FROM ucview WHERE CURRENT OF c1; -- fail, views not supported
ERROR:  WHERE CURRENT OF on a view is not implemented
ROLLBACK;
