--
-- UPDATE syntax tests
--
CREATE TABLE update_test (
    a   INT DEFAULT 10,
    b   INT,
    c   TEXT
);
CREATE TABLE upsert_test (
    a   INT PRIMARY KEY,
    b   TEXT
);
INSERT INTO update_test VALUES (5, 10, 'foo');
INSERT INTO update_test(b, a) VALUES (15, 10);
SELECT * FROM update_test;
 a  | b  |  c  
----+----+-----
  5 | 10 | foo
 10 | 15 | 
(2 rows)

UPDATE update_test SET a = DEFAULT, b = DEFAULT;
SELECT * FROM update_test;
 a  | b |  c  
----+---+-----
 10 |   | foo
 10 |   | 
(2 rows)

-- aliases for the UPDATE target table
UPDATE update_test AS t SET b = 10 WHERE t.a = 10;
SELECT * FROM update_test;
 a  | b  |  c  
----+----+-----
 10 | 10 | foo
 10 | 10 | 
(2 rows)

UPDATE update_test t SET b = t.b + 10 WHERE t.a = 10;
SELECT * FROM update_test;
 a  | b  |  c  
----+----+-----
 10 | 20 | foo
 10 | 20 | 
(2 rows)

--
-- Test VALUES in FROM
--
UPDATE update_test SET a=v.i FROM (VALUES(100, 20)) AS v(i, j)
  WHERE update_test.b = v.j;
SELECT * FROM update_test;
  a  | b  |  c  
-----+----+-----
 100 | 20 | foo
 100 | 20 | 
(2 rows)

-- fail, wrong data type:
UPDATE update_test SET a = v.* FROM (VALUES(100, 20)) AS v(i, j)
  WHERE update_test.b = v.j;
ERROR:  column "a" is of type integer but expression is of type record
LINE 1: UPDATE update_test SET a = v.* FROM (VALUES(100, 20)) AS v(i...
                                   ^
HINT:  You will need to rewrite or cast the expression.
--
-- Test multiple-set-clause syntax
--
INSERT INTO update_test SELECT a,b+1,c FROM update_test;
SELECT * FROM update_test;
  a  | b  |  c  
-----+----+-----
 100 | 20 | foo
 100 | 20 | 
 100 | 21 | foo
 100 | 21 | 
(4 rows)

UPDATE update_test SET (c,b,a) = ('bugle', b+11, DEFAULT) WHERE c = 'foo';
SELECT * FROM update_test;
  a  | b  |   c   
-----+----+-------
 100 | 20 | 
 100 | 21 | 
  10 | 31 | bugle
  10 | 32 | bugle
(4 rows)

UPDATE update_test SET (c,b) = ('car', a+b), a = a + 1 WHERE a = 10;
SELECT * FROM update_test;
  a  | b  |  c  
-----+----+-----
 100 | 20 | 
 100 | 21 | 
  11 | 41 | car
  11 | 42 | car
(4 rows)

-- fail, multi assignment to same column:
UPDATE update_test SET (c,b) = ('car', a+b), b = a + 1 WHERE a = 10;
ERROR:  multiple assignments to same column "b"
-- uncorrelated sub-select:
UPDATE update_test
  SET (b,a) = (select a,b from update_test where b = 41 and c = 'car')
  WHERE a = 100 AND b = 20;
SELECT * FROM update_test;
  a  | b  |  c  
-----+----+-----
 100 | 21 | 
  11 | 41 | car
  11 | 42 | car
  41 | 11 | 
(4 rows)

-- correlated sub-select:
UPDATE update_test o
  SET (b,a) = (select a+1,b from update_test i
               where i.a=o.a and i.b=o.b and i.c is not distinct from o.c);
SELECT * FROM update_test;
 a  |  b  |  c  
----+-----+-----
 21 | 101 | 
 41 |  12 | car
 42 |  12 | car
 11 |  42 | 
(4 rows)

-- fail, multiple rows supplied:
UPDATE update_test SET (b,a) = (select a+1,b from update_test);
ERROR:  more than one row returned by a subquery used as an expression
-- set to null if no rows supplied:
UPDATE update_test SET (b,a) = (select a+1,b from update_test where a = 1000)
  WHERE a = 11;
SELECT * FROM update_test;
 a  |  b  |  c  
----+-----+-----
 21 | 101 | 
 41 |  12 | car
 42 |  12 | car
    |     | 
(4 rows)

-- *-expansion should work in this context:
UPDATE update_test SET (a,b) = ROW(v.*) FROM (VALUES(21, 100)) AS v(i, j)
  WHERE update_test.a = v.i;
-- you might expect this to work, but syntactically it's not a RowExpr:
UPDATE update_test SET (a,b) = (v.*) FROM (VALUES(21, 101)) AS v(i, j)
  WHERE update_test.a = v.i;
ERROR:  source for a multiple-column UPDATE item must be a sub-SELECT or ROW() expression
LINE 1: UPDATE update_test SET (a,b) = (v.*) FROM (VALUES(21, 101)) ...
                                        ^
-- if an alias for the target table is specified, don't allow references
-- to the original table name
UPDATE update_test AS t SET b = update_test.b + 10 WHERE t.a = 10;
ERROR:  invalid reference to FROM-clause entry for table "update_test"
LINE 1: UPDATE update_test AS t SET b = update_test.b + 10 WHERE t.a...
                                        ^
HINT:  Perhaps you meant to reference the table alias "t".
-- Make sure that we can update to a TOASTed value.
UPDATE update_test SET c = repeat('x', 10000) WHERE c = 'car';
SELECT a, b, char_length(c) FROM update_test;
 a  |  b  | char_length 
----+-----+-------------
    |     |            
 21 | 100 |            
 41 |  12 |       10000
 42 |  12 |       10000
(4 rows)

-- Test ON CONFLICT DO UPDATE
INSERT INTO upsert_test VALUES(1, 'Boo');
-- uncorrelated  sub-select:
WITH aaa AS (SELECT 1 AS a, 'Foo' AS b) INSERT INTO upsert_test
  VALUES (1, 'Bar') ON CONFLICT(a)
  DO UPDATE SET (b, a) = (SELECT b, a FROM aaa) RETURNING *;
 a |  b  
---+-----
 1 | Foo
(1 row)

-- correlated sub-select:
INSERT INTO upsert_test VALUES (1, 'Baz') ON CONFLICT(a)
  DO UPDATE SET (b, a) = (SELECT b || ', Correlated', a from upsert_test i WHERE i.a = upsert_test.a)
  RETURNING *;
 a |        b        
---+-----------------
 1 | Foo, Correlated
(1 row)

-- correlated sub-select (EXCLUDED.* alias):
INSERT INTO upsert_test VALUES (1, 'Bat') ON CONFLICT(a)
  DO UPDATE SET (b, a) = (SELECT b || ', Excluded', a from upsert_test i WHERE i.a = excluded.a)
  RETURNING *;
 a |             b             
---+---------------------------
 1 | Foo, Correlated, Excluded
(1 row)

DROP TABLE update_test;
DROP TABLE upsert_test;
-- update to a partition should check partition bound constraint for the new tuple
create table range_parted (
	a text,
	b int
) partition by range (a, b);
create table part_a_1_a_10 partition of range_parted for values from ('a', 1) to ('a', 10);
create table part_a_10_a_20 partition of range_parted for values from ('a', 10) to ('a', 20);
create table part_b_1_b_10 partition of range_parted for values from ('b', 1) to ('b', 10);
create table part_b_10_b_20 partition of range_parted for values from ('b', 10) to ('b', 20);
insert into part_a_1_a_10 values ('a', 1);
insert into part_b_10_b_20 values ('b', 10);
-- fail
update part_a_1_a_10 set a = 'b' where a = 'a';
ERROR:  new row for relation "part_a_1_a_10" violates partition constraint
DETAIL:  Failing row contains (b, 1).
update range_parted set b = b - 1 where b = 10;
ERROR:  new row for relation "part_b_10_b_20" violates partition constraint
DETAIL:  Failing row contains (b, 9).
-- ok
update range_parted set b = b + 1 where b = 10;
-- Creating default partition for range
create table part_def partition of range_parted default;
\d+ part_def
                                  Table "public.part_def"
 Column |  Type   | Collation | Nullable | Default | Storage  | Stats target | Description 
--------+---------+-----------+----------+---------+----------+--------------+-------------
 a      | text    |           |          |         | extended |              | 
 b      | integer |           |          |         | plain    |              | 
Partition of: range_parted DEFAULT
Partition constraint: (NOT (((a = 'a'::text) AND (b >= 1) AND (b < 10)) OR ((a = 'a'::text) AND (b >= 10) AND (b < 20)) OR ((a = 'b'::text) AND (b >= 1) AND (b < 10)) OR ((a = 'b'::text) AND (b >= 10) AND (b < 20))))

insert into range_parted values ('c', 9);
-- ok
update part_def set a = 'd' where a = 'c';
-- fail
update part_def set a = 'a' where a = 'd';
ERROR:  new row for relation "part_def" violates partition constraint
DETAIL:  Failing row contains (a, 9).
create table list_parted (
	a text,
	b int
) partition by list (a);
create table list_part1  partition of list_parted for values in ('a', 'b');
create table list_default partition of list_parted default;
insert into list_part1 values ('a', 1);
insert into list_default values ('d', 10);
-- fail
update list_default set a = 'a' where a = 'd';
ERROR:  new row for relation "list_default" violates partition constraint
DETAIL:  Failing row contains (a, 10).
-- ok
update list_default set a = 'x' where a = 'd';
-- cleanup
drop table range_parted;
drop table list_parted;
